Question,Answer
How do I live with vision loss from AMD?,"Not everyone with AMD develops late AMD or gets it in both eyes. But if you do, living with vision loss from AMD can be challenging. Having low vision means that even with glasses, contact lenses, medicine, or surgery, your vision loss makes it hard to do everyday tasks. The good news is, there are things that can help — like low vision devices and vision rehab services. Vision rehab can help you learn the skills you need to stay independent and active with low vision."
What is amblyopia?,"Amblyopia (also called lazy eye) is a type of poor visionthat usually happens in just 1 eye but less commonly in both eyes. It develops when there’s a breakdown in how the brain and the eye work together, and the brain can’t recognize the sight from 1 eye. Over time, the brain relies more and more on the other, stronger eye — while vision in the weaker eye gets worse. It’s called “lazy eye” because the stronger eye worksbetter. But people with amblyopia are not lazy, and they can’t control the way their eyes work. Amblyopia starts in childhood, and..."
What are the symptoms of amblyopia?,"Symptoms of amblyopia can be hard to notice. Kids with amblyopia may have poor depth perception — they have trouble telling how near or far something is. Parents may also notice signs that their child is struggling to see clearly, like: Squinting Shutting 1 eye Tilting their head In many cases, parents don’t know their child has amblyopia until a doctor diagnoses it during an eye exam. That’s why it’s important for all kids to get a vision screening at least once between ages 3 and 5."
Is my child at risk for amblyopia?,"Some kids are born with amblyopia and others develop it later in childhood. The chances of having amblyopia are higher in kids who: Were born early (premature) Were smaller than average at birth Have a family history of amblyopia, childhood cataracts, or other eye conditions Have developmental disabilities"
What causes amblyopia?,"In many cases, doctors don’t know the cause of amblyopia. But sometimes, a different vision problem can lead to amblyopia. Normally, the brain uses nerve signals from both eyes to see. But if an eye condition makes vision in 1 eye worse, the brain may try to work around it. It starts to “turn off” signals from the weaker eye and rely only on the stronger eye. Some eye conditions that can lead to amblyopia are: Refractive errors.These include common vision problems like nearsightedness (having trouble seeing far away), farsightedness (having trouble seeing things up close), and astigmatism (which can........."
How will my child’s doctor check for amblyopia?,"As part of a normalvision screening, your child’s doctor will look for signs of amblyopia. All kids ages 3 to 5 need to have their vision checked at least once."
What’s the treatment for amblyopia?,"If there’s a vision problem causing amblyopia, the doctor may treat that first. For example, doctors may recommend glasses or contacts (for kids who are nearsighted or farsighted) or surgery (for kids with cataract). The next step is to re-train the brain and force it to use the weaker eye. The more the brain uses it, the stronger it gets. Treatments include: Wearing an eye patch on the stronger eye.By covering up this eye with a stick-on eye patch (similar to a Band-Aid), the brain has to use the weaker eye to see. Some kids only need to wear the....................."
What is astigmatism?,Astigmatism is a common eye problem that can make your vision blurry or distorted. It happens when your cornea (the clear front layer of your eye) or lens (an inner part of your eye that helps the eye focus) has a different shape than normal. The only way to find out if you have astigmatism is to get an eye exam. Eyeglasses or contact lenses can help you see better — and some people can get surgery to fix their astigmatism.
What are the symptoms of astigmatism?,"The most common symptoms of astigmatism are: Blurry vision Needing to squint to see clearly Headaches Eye strain Trouble seeing at night If you have mild astigmatism, you might not notice any symptoms. That’s why it’s important to get regular eye exams — your eye doctor can help you make sure you’re seeing as clearly as possible. This is especially true for children, who may be less likely to realize that their vision isn’t normal."
What causes astigmatism?,"Astigmatism happens when your cornea or lens has a different shape than normal. The shape makes light bend differently as it enters your eye, causing a refractive error. Doctors don’t know what causes astigmatism, and there’s no way to prevent it. Some people are born with astigmatism, but many people develop it as children or young adults. Some people may also develop astigmatism after an eye injury or an eye surgery."
How will my eye doctor check for astigmatism?,Eye doctors can check for astigmatism as part of a dilated eye exam. The exam is simple and painless.
What's the treatment for astigmatism?,"The most common treatments for astigmatism are eyeglasses orcontact lenses. Your eye doctor will prescribe the right lenses to help you see as clearly as possible. Doctors can also use surgery to treat astigmatism.The surgery changes the shape of your cornea so that it can focus light correctly. If your astigmatism is mild, you may not need treatment. Your eye doctor can help you figure out if you need to get treated, and what type of treatment is best for you. Last updated:November 15, 2023"
What are cataracts?,"A cataract is a cloudy area in the lens of your eye(theclear part of the eye that helps to focus light). Cataracts are very common as you get older.In fact, more than half of all Americans age 80 or older either have cataracts or have had surgery to get rid of cataracts. At first, you may not notice that you have a cataract. But over time, cataracts can make your vision blurry, hazy, or less colorful. You may have trouble reading or doing other everyday activities. Over time, cataracts can lead to vision loss. The good news is that surgery..."
What are the types of cataracts?,"Most cataracts arerelatedto age— they happen because of normal changes in your eyes as you get older. But you can get cataracts for other reasons —likeafter an eye injury or after surgery for another eye problem (likeglaucoma). No matter what type of cataract you have,you’ll need surgery to treatit."
What are the symptoms of cataracts?,"You might not have any symptoms at first, when cataracts are mild. But as they grow, cataracts can cause changes in your vision. For example, you may notice that: Your vision is cloudy or blurry Colors look faded You can’t see well at night Lamps, sunlight, or headlights seem too bright You see a halo around lights You see double (this sometimes goes away as the cataract gets bigger) You have to change the prescription for your glasses or contact lenses often Talk with your eye doctor if you have any of these symptoms — they could also be signs..."
Am I at risk for cataracts?,"Your risk for cataracts goes up as you get older. You’re also at higher risk if you: Have certain health problems, like diabetes Smoke Drink too much alcohol Have a family history of cataracts Have had an eye injury, eye surgery, or radiation treatment on your upper body Have spent a lot of time in the sun Take steroids — medicines used to treat some health problems, like arthritis or allergies If you’re worried you might be at risk for cataracts, talk with your doctor. Ask if there’s anything you can do to lower your risk."
What causes cataracts?,"Most cataracts happen because of normal changes in your eyes as you get older. When you’re young, the lens in your eye is clear. Around age 40, the proteins in the lens of your eye start to break down and clump together. This clump makes a cloudy area on your lens — known as a cataract. Over time, the cataract gets worse and makes more of your lens cloudy."
How can I prevent cataracts?,"You can take steps to protect your eyes from cataracts: Protect your eyes from the sun.Wear sunglasses and a hat with a brim to block the sun. Protect your eyes from injury.While doing activities like using power tools or playing certain sports, wear protective eyewear to protect your eyes from getting accidentally injured. Quit smoking.If you’re ready to quit, call 1-800-QUIT-NOW (1-800-784-8669) for free support. Make eye-healthy food choices.Eat plenty of healthy foods — like fruits and vegetables, leafy greens, nuts, and whole grains."
How will my eye doctor check for cataracts?,"An eye doctor can check for cataracts as part of a dilated eye exam. If you’re age 60 or older, get a dilated eye exam every 1 to 2 years. The exam is simple and painless — your doctor will give you some eye drops to dilate (widen) your pupil and then check your eyes for cataracts and other eye problems."
What’s the treatment for cataracts?,"Surgery is the only way to get rid of a cataract, but you may not need to get surgery right away. Home treatment.Early on, you may be able to make small changes to manage cataracts. You can do things like:Use brighter lights at home or workWear anti-glare sunglassesUse magnifying lenses for reading and other activities Home treatment.Early on, you may be able to make small changes to manage cataracts. You can do things like: Use brighter lights at home or work Wear anti-glare sunglasses Use magnifying lenses for reading and other activities New glasses or contacts.A new prescription for eyeglasses.............................."
What’s the latest research on cataracts?,Scientists are studying what causes cataracts and how we can find them earlier and treat them better. NEI also funds research on new treatment options.
What are the types of color vision deficiency?,"The most common type of color vision deficiency makes it hard to tell the difference between red and green. Another type makes blue and yellow look the same. In rare cases, people have complete color vision deficiency, which means they don’t see color at all."
What are the symptoms of color vision deficiency?,"The main symptom of color vision deficiency is not seeing colors the way most people do. If you have color vision deficiency, you may have trouble seeing: The difference between colors How bright colors are Different shades of colors Symptoms of color vision deficiency are often so mild that they’re hard to notice. That’s why many people with color vision deficiency don’t know they have it. And people usually adjust to differences in how they see color. People with very serious cases of color vision deficiency might have other symptoms, too — like quick side-to-side eye movements (nystagmus) or sensitivity..."
Am I at risk for color vision deficiency?,"Men have a much higher risk than women for color vision deficiency. You’re also more likely to have color vision deficiency if you: Have a family history of color vision deficiency Have certain eye diseases Have certain health problems, like diabetes, Alzheimer’s disease, or multiple sclerosis (MS) Take certain medicines Are white If you think you may have color vision deficiency, talk with your eye doctor about getting checked."
What causes color vision deficiency?,"Most people who have color vision deficiency are born with it. This is because the most common types of color vision deficiency are genetic, meaning they’re passed down from parents. Color vision deficiency can also happen because of an injury to the retina (the light-sensitive layer of tissue in the back of the eye), the optic nerve (which connects the eye to the brain), or the brain itself.Some examples of injuries that can lead to color vision deficiency are: Retinal detachment(when the retina is pulled away from its normal position at the back of the eye) Eye injuries caused by............"
What's the treatment for color vision deficiency?,"There’s no cure for color vision deficiency that’s passed down in families (inherited), but most people adjust to it. Children with color vision deficiency may need help with some classroom activities, and adults with color vision deficiency may need accommodations to do jobs that rely on telling the difference between colors,like being a graphic designer. If your color vision deficiency is happening because of another health problem, your doctor will treat the condition that’s causing the problem. If you’re taking a medicine that causes color vision deficiency, your doctor may adjust how much you take or suggest you switch to.................."
What is the latest research on color vision deficiency?,"Research studies suggest that gene therapies (treatments that change genes in a target location) are promising fora severe type of color vision deficiency. Last updated:November 15, 2023"
What is the cornea?,The cornea is the clear outer layer at the front of the eye.Thecornea helps your eye to focus light so you can see clearly.
What are the main types of corneal conditions?,"There are several common conditions that affect thecornea. Injuries. Small abrasions (scratches) on the cornea usually heal on their own. Deeper scratches or other injuries can cause corneal scarring and vision problems. Allergies. Allergies to pollen can irritate the eyes and cause allergic conjunctivitis (pink eye). This can make your eyes red, itchy, and watery. Keratitis. Keratitis is inflammation (redness and swelling) of the cornea. Infections related to contact lenses are the most common cause of keratitis. Dry eye. Dry eye happens when your eyes don’t make enough tears to stay wet. This can be uncomfortable and may cause vision........."
Am I at risk for corneal conditions?,"Some corneal conditions, like corneal dystrophies, run in families. But there are steps you can take to lower your risk of corneal injuries and infections. Toprevent corneal injuries,wear protective eyewear when you: Play sports that use a ball or puck, like baseball or hockey Do yardwork, like mowing the lawn or using a weedwhacker Make repairs, like painting or hammering Use machines, like sanders or drills Use chemicals, like bleach or pesticides If you wear contact lenses, always follow the instructions to clean, disinfect, and store your lenses. This can help prevent corneal infections, like keratitis."
Feel like something’s stuck in your eye?,"Try blinking several times Try rinsing your eye with clean water or saline (salt) solution Try pulling your upper eyelid down over your lower eyelid Don’t rub your eye — you could scratch your cornea If an object is stuck in your eye, don’t try to remove it yourself — go to your eye doctor or the emergency room"
How will my eye doctor check for corneal conditions?,"Eye doctors can check for corneal conditions as part of a comprehensiveeye exam. The exam is simple and painless. To check for corneal abrasions (scratches), your eye doctor may use a special type of eye drops called fluorescein dye. The dye makes corneal abrasions easier to see."
What is the treatment for corneal conditions?,"Many corneal conditions can be treated with prescription eye drops or pills. If you have advanced corneal disease, you may need a different treatment. Laser treatment.To treat some corneal dystrophies and other conditions, doctors can use a type of laser treatment called phototherapeutic keratectomy (PTK) to reshape the cornea, remove scar tissue, and make vision clearer. Laser treatment.To treat some corneal dystrophies and other conditions, doctors can use a type of laser treatment called phototherapeutic keratectomy (PTK) to reshape the cornea, remove scar tissue, and make vision clearer. Corneal transplant surgery.If the damage to your cornea can’t be repaired, doctors..............."
What is the latest research on corneal conditions?,"Scientists are studying what causes corneal disease and how we can find it earlier and treat it better. NEI also funds research on new treatment options. Last updated:November 15, 2023"
What is diabetic retinopathy?,"Diabetic retinopathy is an eye condition that can cause vision loss and blindness in people who have diabetes. It affects blood vessels in the retina (the light-sensitive layer of tissue in the back of your eye). If you have diabetes, it’s important to get a comprehensive dilated eye exam at least once a year. Diabetic retinopathy may not have any symptoms at first — but finding it early can help you take steps to protect your vision. Managing your diabetes — by staying physically active, eating healthy, and taking your medicine — can also help you prevent or delay vision..."
What are the symptoms of diabetic retinopathy?,"The early stages of diabetic retinopathy usually don’t have any symptoms. Some people notice changes in their vision, like trouble reading or seeing faraway objects. These changes may come and go. In later stages of the disease, blood vessels in the retina start to bleed into the vitreous (gel-like fluid that fills your eye). If this happens, you may see dark, floating spots or streaks that look like cobwebs. Sometimes, the spots clear up on their own — but it’s important to get treatment right away. Without treatment, scars can form in the back of the eye. Blood vessels may..."
What other problems can diabetic retinopathy cause?,"Diabetic retinopathy can lead to other serious eye conditions: Diabetic macular edema (DME).Over time, about 1 in 15 people with diabeteswill develop DME. DME happens when blood vessels in the retina leak fluid into the macula (a part of the retina needed for sharp, central vision). This causes blurry vision. Neovascular glaucoma.Diabetic retinopathy can cause abnormal blood vessels to grow out of the retina and block fluid from draining out of the eye. This causes a type of glaucoma (a group of eye diseases that can cause vision loss and blindness). Retinal detachment.Diabetic retinopathy can cause scars to form in..."
Am I at risk for diabetic retinopathy?,"Anyone with any kind of diabetes can get diabetic retinopathy — including people with type 1, type 2, and gestational diabetes (a type of diabetes that can develop during pregnancy). Your risk increases the longer you have diabetes.Over time, more than half of people with diabetes will develop diabetic retinopathy.The good news is that you can lower your risk of developing diabetic retinopathy by controlling your diabetes. Women with diabetes who become pregnant — or women who develop gestational diabetes — are at high risk for getting diabetic retinopathy. If you have diabetes and are pregnant, have a comprehensive dilated..."
What causes diabetic retinopathy?,"Diabetic retinopathy is caused by high blood sugar due to diabetes. Over time, having too much sugar in your blood can damage your retina — the part of your eye that detects light and sends signals to your brain through a nerve in the back of your eye (optic nerve). Diabetes damages blood vessels all over the body. The damage to your eyes starts when the sugar in your blood causes changes to the tiny blood vessels that go to your retina. These changes make it harder for the blood to flow, leading to blocked blood vessels that leak fluid..."
How will my eye doctor check for diabetic retinopathy?,"Eye doctors can check for diabetic retinopathy as part of a dilated eye exam. The exam is simple and painless — your doctor will give you some eye drops to dilate (widen) your pupil and then check your eyes for diabetic retinopathy and other eye problems. If you have diabetes, it’s very important to get regular eye exams. If you do develop diabetic retinopathy, early treatment can stop the damage and prevent blindness. If your eye doctor thinks you may have severe diabetic retinopathy or DME, they may do a test called a fluorescein angiogram. This test lets the doctor..."
What can I do to prevent diabetic retinopathy?,"Managing your diabetes is the best way to lower your risk of diabetic retinopathy. That means keeping your blood sugar levels in a healthy range. You can do this by getting regular physical activity, eating healthy, and carefully following yourdoctor’sinstructions for your insulin or other diabetes medicines. To make sure your diabetes treatment plan is working, you’ll need a special lab test called an A1C test. This test shows your average blood sugar level over the past 3 months. You can work with your doctor to set a personal A1C goal. Meeting your A1C goal can help prevent or manage......"
What’s the treatment for diabetic retinopathy and DME?,"In the early stages of diabetic retinopathy, your eye doctor will probably just keep track of how your eyes are doing. Some people with diabetic retinopathy may need a comprehensive dilated eye exam as often as every 2 to 4 months. In later stages, it’s important to start treatment right away — especially if you have changes in your vision. While it won’t undo any damage to your vision, treatment can stop your vision from getting worse. It’s also important to take steps to control your diabetes, blood pressure, and cholesterol. Injections.Medicines called anti-VEGF drugs can slow down or reverse..........................."
What is the latest research on diabetic retinopathy and DME?,"Scientists are studying better ways to find, treat, and prevent vision loss in people with diabetes. One NIH-funded research team is studying whether a cholesterol medicine called fenofibrate can stop diabetic retinopathy from getting worse."
What is dry eye?,"Dry eye happens when your eyes don’t make enough tears to stay wet, or when your tears don’t work correctly. This can make your eyes feel uncomfortable, and in some cases it can also cause vision problems. Dry eye is common — it affects millions of Americans every year. The good news is that if you have dry eye, there are lots of things you can do to keep your eyes healthy and stay comfortable."
What are the symptoms of dry eye?,"Dry eye can cause: A scratchy feeling, like there’s something in your eye Stinging or burning feelings in your eye Red eyes Sensitivity to light Blurry vision"
Am I at risk for dry eye?,"Anyone can get dry eye, but you might be more likely to have dry eye if you: Are age 50 or older Are female Wear contact lenses Don’t get enough vitamin A (found in foods like carrots, broccoli, and liver) or omega-3 fatty acids (found in fish, walnuts, and vegetableoils) Have certain autoimmune conditions, like lupus or Sjögren syndrome"
What causes dry eye?,"Normally, glands above your eyes make tears that keep your eyes wet. Dry eye happens when your tears don’t do their job. This could mean: Your glands don’t make enough tears to keep your eyes wet Your tears dry up too fast Your tears just don’t work well enough to keep your eyes wet"
How will my eye doctor check for dry eye?,"Your doctor can check for dry eye as part of acomprehensive dilated eye exam. The exam is simple and painless — your doctor will give you some eye drops to dilate (widen) your pupil and then check your eyes for dry eye and other eye problems.  Be sure to tell your doctor if you think you might have dry eye. To find out if you have dry eye, your doctor might check: The amount of tears your eyes make How long it takes for your tears to dry up The structure of your eyelids"
What’s the treatment for dry eye?,Treatment for dry eye usually depends on what’s causing your symptoms. There are a few different types of treatment that can ease your symptoms and help keep your eyes healthy. Over-the-counter eye drops.The most common treatment for mild dry eye is a type of eye drops called artificial tears. You can get these eye drops without a prescription. There are also over-the-counter moisturizing gels and ointments that may help your eyes feel better. Over-the-counter eye drops.The most common treatment for mild dry eye is a type of eye drops called artificial tears. You can get these eye drops without a............................................................
What's the latest research on dry eye?,Scientists are studying what causes dry eye and how we can treat it better. NEI also funds research on new treatment options.
What are floaters?,"Floaters are small dark shapes that float across your vision. They can look like spots, threads, squiggly lines, or even little cobwebs. Most people have floaters that come and go, and they often don’t need treatment. But sometimes floaters can be a sign of a more serious eye condition. So if you notice new floaters that appear suddenly and don’t go away, it’s important to tell your eye doctor."
What are the symptoms of floaters?,"Floaters move as your eyes move — so when you try to look at them directly, they seem to move away. When your eyes stop moving, floaters keep drifting across your vision. You may notice floaters more when you look at something bright, like white paper or a blue sky."
Am I at risk for floaters?,"Almost everyone develops floaters as they get older, but some people are at higher risk. You’re at higher risk if you: Are very nearsighted Have diabetes Have had surgery to treat cataracts"
What causes floaters?,"Floaters usually happen because of normal changes in your eyes. As you age, tiny strands of your vitreous (the gel-like fluid that fills your eye) stick together and cast shadows on your retina (the light-sensitive layer of tissue at the back of the eye). Those shadows appear as floaters. Sometimes floaters have more serious causes, including: Eye infections Eye injuries Uveitis(inflammation in the eye) Bleeding in the eye Vitreous detachment(when the vitreous pulls away from the retina) Retinal tear (when vitreous detachment tears a hole in the retina) Retinal detachment(when the retina gets pulled away from the back of the..."
