Question,Answer
What Is the Cornea?,"The cornea is essential to vision. It refracts and focuses light entry, acts as a filter screening out damaging ultraviolet rays, and helps shield the rest of the eye from harmful matter. Because the cornea has many functions, corneal disease, injury, and genetic or physiological problems can cause many eyesight problems. Moran Eye Center cornea specialists provide the most advanced medical and surgical treatment options for disorders of the cornea, conjunctiva, iris, and lens, as well as complications from cataract surgery. Allergies Blepharitis Cataract Chalazion Choroidal Nevus Corneal dystrophiesFuchs’ dystrophyKeratoconusLattice dystrophyMap-dot-fingerprint dystrophy Fuchs’ dystrophy Keratoconus Lattice dystrophy Map-dot-fingerprint dystrophy Corneal infections Dry eye Iridocorneal endothelial syndrome Ocular Herpes Pinguecula Pink eye (conjunctivitis) Pterygium Shingles (herpes zoster) Stevens-Johnson syndrome Stye Subconjunctival hemorrhage About Us Academics & Research Billing Find an Interpreter Giving Jobs Maps & Directions Newsroom Referring Providers Patient Rights & Responsibilities Disclaimer Privacy Statement DNV GL Public Information Policy Non-Discrimination Policy Surprise Billing Rights Webmaster  65 Mario Capecchi DriveSalt Lake City,    Utah
    84132 801-581-2352"
What is Eye Cancer?,"Any cancer that starts in or around the eye is called eye cancer. Cancer starts when cells mutate. Ocular oncologists specialize in treating eye cancer. Different types of cancer start in different parts of the eye. Your eye has three main parts: the eyeball; the orbit, tissues surrounding the eye; and structures such as the eyelids and tear glands. Here are some examples of eye cancers: Intraocular cancers:Uveal melanomaLymphoma Uveal melanoma Lymphoma Retinoblastoma, the most common eye cancer in children Cancers on the surface of the eye Metastatic cancers Benign tumors Blurry vision or sudden loss of vision Floaters in your eye (spots or squiggles that drift in your field of vision) or flashes of light A growing dark spot on your iris, the colored part of the eye Pupil changes in size or shape Eyeball changes position within its socket Bulging eyeballs These symptoms may not be due to cancer. They could be from a different condition. A physician can evaluate these symptoms. Patients with eye cancer rarely feel pain, unless the tumor has grown outside the eyeball. There is no exact cause, but certain types of characteristics have been linked with eye cancer. Race/ethnicity Eye color Age and."
Should You Get Your Eyes Dilated?,"A thorough, dilated exam lets your ophthalmologist do a complete exam of the retina. This is important to do throughout your life because several eye diseases and conditions are detected at their earliest stages during a thorough eye exam. About Us Academics & Research Billing Find an Interpreter Giving Jobs Maps & Directions Newsroom Referring Providers Patient Rights & Responsibilities Disclaimer Privacy Statement DNV GL Public Information Policy Non-Discrimination Policy Surprise Billing Rights Webmaster  65 Mario Capecchi DriveSalt Lake City,    Utah
    84132 801-581-2352"
What Is Glaucoma?,"Glaucoma Symptoms & Causes Types of Glaucoma Glaucoma Treatment Glaucoma is a group of eye diseases that damage the optic nerve. The optic nerve is the part of your eye that carries information defining what you see to your brain. Your brain then turns the information into images. Though there are probably several factors that contribute to glaucoma, the one we understand the best is eye pressure. With glaucoma, fluid builds up in your eye and increases pressure. This increased pressure damages the optic nerve over time. Without treatment, optic nerve damage can cause vision loss and eventual blindness. Around 3 million people in the United States have glaucoma. The disease mostly affects adults, but glaucoma can occur in people of any age. Glaucoma is hereditary (tends to run in families). You should see an optometrist or ophthalmologist for glaucoma screening if you have a family member with glaucoma. Acataractis a disease affecting your lens, the clear curved structure at the front of your eye behind your pupil. Glaucoma affects your optic nerve. Both cataracts and glaucoma can cause vision problems. Cataracts tend to affect your general, overall vision, while glaucoma affects your outer (peripheral) vision first then moves inward.."
Am I a Candidate for LASIK?,"LASIK is a medical procedure that improves your vision by using a laser. In order to be a candidate for LASIK, you must meet specific criteria involving refractive errors, corneal thickness, and pupil size. You must also meet basic health and age criteria to help you achieve the best possible vision. A LASIK candidate: Should be between 21 and 50 years old Must not have certain systemic diseases, like lupus, rheumatoid arthritis, collagen vascular disorders, and uncontrolled diabetes Should be in generally good eye health Must not currently be pregnant or nursing No Accutane use within the past three months The best way to find out if you're a candidate for LASIK is to have a thorough examination by a qualified refractive surgeon.During your consultation, our surgeon will: Examine your eyes Tell you about your treatment options Answer any questions you might have To schedule a refractive surgery vision consultation, please call 801-581-2352. Soft contact lens patients: If you are wearing soft contact lenses, please remove them from your eyes one week before your screening. Gas permeable or hard contact lens patients: If you are wearing gas permeable contact lenses or PMMA hard lenses, please remove them from your eyes."
Why Choose the Moran Eye Center?,"If you need reconstructive treatment or are considering cosmetic eye work, visit Utah's eye specialists. Our experienced surgeons focus on the eyes, performing about 700 oculoplastic surgeries each year. Performing cosmetic and reconstructive surgery gives our surgeons an unparalleled level of specialization and expertise in facial anatomy to ensure the best results. Our surgeons spend years training to develop expertise after completing medical school. We are experienced in working with patients with a wide range of conditions. We provide the highest level of safety and access to advanced surgical facilities for procedures that require local or general anesthesia."
What Can You Do About a Droopy Upper Eyelid?,"When the upper eyelid droops over the eye, it's called ptosis. Children may be born with the condition and adults may develop it with age. It also could develop as a side effect after certain surgeries, diseases, or tumors."
When Does Thyroid Eye Disease Require Surgery?,"Our thyroid eye disease team customizes each case and consults with University of Utah fellowship-trained physicians in endocrinology, sinus and skull base surgery, oculoplastics, and neuro-ophthalmology for medical and surgical treatments. About Us Academics & Research Billing Find an Interpreter Giving Jobs Maps & Directions Newsroom Referring Providers Patient Rights & Responsibilities Disclaimer Privacy Statement DNV GL Public Information Policy Non-Discrimination Policy Surprise Billing Rights Webmaster  65 Mario Capecchi DriveSalt Lake City,    Utah
    84132 801-581-2352"
Why Choose John A. Moran Eye Center?,"TheMoran Eye Centeris the only eye care center backed by theUniversity of Utah. With locations across the Wasatch Front, you’ll find expert care in your own neighborhood. If you’re looking for an eye exam from a highly trained optometrist, Moran has everything you need to improve your vision. Our optometrists provide the highest level of optometry care available in the Mountain West region. We have a number of offers: Contact lens trials prior to purchase FL-41 and Avulux tinted glassesfor patients with light-sensitive conditions Unlimited, free lifetime adjustments, cleanings, and nose pad replacements for glasses purchased at any of ourcenters Personalized measurements to make sure you’re looking through the ideal spot in your lenses Price match guarantees on identical frame and lens combinations Reduced pricing using contact lens manufacturer rebate programs The highest quality materials and frames Our extensive warranty covers a range of benefits. Frames: 1–2 years with a one-time replacement Lens: One year with a one-time replacement for scratches; two years with a one-time replacement for anti-reflective coating Prescription changes: One-time replacement within 180 days of purchase Refunds/exchanges: Frame restyle or exchange within 30 days of purchase; contact lens refund if unopened and in sellable condition Our optometrists."
Does my vision loss qualify me for Social Security Disability?,You can get disability benefits if you are legally blind or if your vision problems prevent you from working. Legal blindness is when your vision cannot be corrected better than 20/200 or if your visual field is 20 degrees or less in your better eye.
What is Low Vision and How Can you Make the Best of It?,"Whether you have been diagnosed with “low vision” or know someone who has, Lisa Ord, PhD, LCSW, director of the John A. Moran Eye Center’s Patient Support Program,wants you to know the facts about this often-misunderstood condition. Daisy Callister's experience with retinoblastoma inspired “Mina and Her New Eye,” a new children's book created by the Patient Support Program at the Moran Eye Center. Patient Support Presentation-Idiopathic Intracranial Hypertension Moran's Kathleen B. Digre, MD, reviews the symptoms and causes of Idiopathic Intracranial Hypertension (IIH), and the latest options to treat headache and prevent visual loss. About Us Academics & Research Billing Find an Interpreter Giving Jobs Maps & Directions Newsroom Referring Providers Patient Rights & Responsibilities Disclaimer Privacy Statement DNV GL Public Information Policy Non-Discrimination Policy Surprise Billing Rights Webmaster  65 Mario Capecchi DriveSalt Lake City,    Utah
    84132 801-581-2352"
Why Cornea & Eye Donation?,"About Us Academics & Research Billing Find an Interpreter Giving Jobs Maps & Directions Newsroom Referring Providers Patient Rights & Responsibilities Disclaimer Privacy Statement DNV GL Public Information Policy Non-Discrimination Policy Surprise Billing Rights Webmaster  65 Mario Capecchi DriveSalt Lake City,    Utah
    84132 801-581-2352"
What Is Uveitis?,"Uveitis is a condition that occurs in the uvea, or the middle area of the eye. Because the uvea contains the blood vessels that supply nutrients to the eye, any form of uveitis may be serious and may be a symptom of other serious conditions. There are three types of uveitis: Anterior uveitisis the most common form of uveitis. It affects the iris and ciliary body and may be associated with autoimmune disorders such as various types of arthritis. Iritis may develop suddenly and may last up to eight weeks, even with treatment, or may have a chronic course, requiring prolonged treatment. Intermediate uveitisis an inflammation of the middle portion of the eye, the vitreous gel, and the retina. This may develop suddenly and last several months or have a chronic, indolent course. Posterior uveitisaffects the back of the eye and involves the retina, choroid, or both. It may progress quickly, making it difficult to treat. Retinitis may be caused by viruses, such as shingles or herpes simplex virus, and bacterial infections, such as syphilis or toxoplasmosis. Choroiditis is an inflammation of the layer beneath the retina. It may also be caused by an infection, such as tuberculosis. Retinitis and."
WHAT ARE CATARACTS?,"Cataract Surgery Understanding Cataracts Femtosecond Laser Intraocular Lens Treatment A cataract is a thickening and hardening of the lens in the eye. As the lens in your eye thickens, the naturally transparent lens becomes clouded or opaque. In its early stages, a cataract may not cause a problem; the cloudiness may affect only a small part of the lens. However, as the cataract grows larger it prevents light from reaching your retina. As less light reaches your retina, it becomes increasingly difficult to see and vision may become dull and blurry. Cataract surgeryis one of the best ways to treat advanced cataracts. A cataract, a clouding of the natural lens of the eye, blurs vision and can eventually lead to blindness. To improve your vision with cataract surgery, your doctor removes the clouded lens and inserts a clear artificial lens, known as an intraocular lens, or IOL, in its place. Cataracts don’t return, so cataract surgery can improve the quality of your vision for years to come. The Moran Eye Center offers the most advanced laser cataract surgery available and our cataract surgery team is dedicated to excellence in both the consultation and treatment of all types of cataracts. Our."
What Causes Corneal Infections?,"Corneal infections can be caused by many things. Sometimes the cornea is damaged after a foreign object has penetrated the tissue, maybe from a poke in the eye. Bacteria or fungi from a contaminated contact lens can also pass into the cornea. These things can cause painful inflammation and corneal infections called keratitis. Keratitis can reduce visual clarity, produce corneal discharges, and possibly erode the cornea. Corneal infections can also lead to corneal scarring, which can impair vision and may require a corneal transplant. As a general rule, the deeper the corneal infection, the more severe the symptoms and complications. Most corneal infections, however, generally happen to individuals that wearcontact lenses. View Video Minor corneal infections are commonly treated with anti-bacterial eye drops. If the problem is severe, your doctor may proscribe intensive antibiotic or anti-fungal treatment for the infection as well as steroid eye drops to reduce inflammation. Frequent visits to an eye care professional may be necessary for several months to eliminate the problem. About Us Academics & Research Billing Find an Interpreter Giving Jobs Maps & Directions Newsroom Referring Providers Patient Rights & Responsibilities Disclaimer Privacy Statement DNV GL Public Information Policy Non-Discrimination Policy Surprise Billing Rights."
Why Choose Moran Eye Center?,"TheMoran Eye Centeroffers accessible, nationally ranked care for our patients. Our team of clinical specialists provides comprehensive eye care at multiple locations to best suit your needs. As the only academic ophthalmologic institution in the state, we have a strong reputation of trust and service across all ages and many levels of care. Our specialists have the expertise and equipment to treat any eye condition, from minor irritation to more advanced eye disease. Ophthalmologists at Moran provide proper diagnoses for many different eye conditions. Our specialists will also help rule out underlying health issues or refer you to our network of providers for ongoing care, if needed. The main symptom of dry eye is usually a scratchy or sandy feeling as if something is in the eye. Other symptoms may include the following: Stinging or burning of the eye Episodes of excess tearing that follow periods of very dry sensation Stringy discharge from the eye Pain and redness of the eye Sometimes people with dry eye experience heaviness of the eyelids or blurred, changing, or decreased vision, although loss of vision is uncommon."
How Long Does Dry Eye Last?,"Dry eye is a chronic condition that will only go away with medication or removal of environmental factors (e.g., reduction of screen time, increased moisture in the air, etc.) Daily treatment may be needed to help ease your dry eye symptoms. You should begin using over-the-counter artificial tears or other recommended home remedies as soon as symptoms occur. Talk with your ophthalmologist if your dry eye does not improve with home care after one to two weeks. See one of our ophthalmologists if you've had signs and symptoms of dry eyes, including red, irritated, tired, or painful eyes for longer than two weeks. Your ophthalmologist will conduct an eye exam and evaluate your symptoms to help determine if more advanced treatment is necessary. Our eye care specialists recommend beginning treatment at home to see if your symptoms improve. Dry eyes may be caused by a variety or combination of factors that interfere with healthy tear film. Your eye’s tear film is made up of three layers: fatty oils, water, and mucus. This combination normally keeps the surface of your eyes naturally moisturized. An imbalance within these layers cause dry eyes. Specific causes may include: cell phone, computer, tablet, or TV."
How Common Are Eye Allergies?,"Allergies affecting the eye are fairly common. The most common allergies are those related to pollen, particularly when the weather is warm and dry. Symptoms can include the following: Redness Itching Tearing Burning Stinging Watery discharge These symptoms, though irritating, are not usually severe enough to need medical attention. Antihistamine decongestant eye drops can reduce these symptoms, as does rain and cooler weather, which decreases the amount of pollen in the air. An increasing number of eye allergy cases are related to medications and contact lens wear. Also, animal hair and certain cosmetics, such as mascara, face creams, and eyebrow pencil, can cause allergies that affect the eye. Touching or rubbing eyes after handling nail polish, soaps, or chemicals may cause an allergic reaction. Some people have sensitivity to lip gloss and eye makeup. Allergy symptoms are temporary and can eliminated by not having contact with the cosmetic or detergent that causes it. About Us Academics & Research Billing Find an Interpreter Giving Jobs Maps & Directions Newsroom Referring Providers Patient Rights & Responsibilities Disclaimer Privacy Statement DNV GL Public Information Policy Non-Discrimination Policy Surprise Billing Rights Webmaster  65 Mario Capecchi DriveSalt Lake City,    Utah
    84132 801-581-2352"
What Is Pink Eye?,Pink eye is a term used to describe a group of diseases also known as conjunctivitis that cause redness and irritation. The conjunctiva is the protective membrane lining the eyelids and covering the sclera (white of the eye).
Why Choose Moran Eye Center?,"TheMoran Eye Centeroffers accessible, nationally ranked care for our patients. Our team of ophthalmologists (eye doctors) provides comprehensive eye care at multiple locations to best suit your needs. As the only academic ophthalmologic institution in the state, we have a strong reputation of trust and service across all ages and many levels of care. Our specialists have the expertise and equipment to treat any eye condition, from minor irritation to more advanced eye disease. Vignette: What is Pink Eye"
What Bacteria Causes Pink Eye?,"Pink eye is usually a viral infection (viral conjunctivitis) caused by a cold virus. However, pink eye from bacteria (bacterial conjunctivitis) is most commonly caused by exposure to staphylococcal or streptococcal bacteria from your own skin or respiratory system. Your ophthalmologist will conduct an exam to determine the type of pink eye you have and recommend proper treatment. Allergic conjunctivitis (allergy-related pink eye) is common among people who suffer from allergic reactions to: pollen, animal dander, dust, chemicals, makeup, contact lens solution, or eye drops. Allergic conjunctivitis may be accompanied by watery discharge from the eye. Unlike viral and bacterial pink conjunctivitis, allergic conjunctivitis is not contagious and always affects both eyes. Your conjunctivitis symptoms may vary depending on the cause and severity, such as sticky matting or crusting over your eye after waking; feeling like something is in your eye; or intense itching due to allergies."
Does Pink Eye Hurt?,"Conjunctivitis is not usually painful, however, your eye or eyes may feel sore or uncomfortable. If you experience intense pain, see your ophthalmologist right away."
What Does Pink Eye Look Like?,"Conjunctivitis appears as increased redness (pink) in the white part of the eye. Visible clear, watery, or mucus-like discharge may also be present. Other visible marks or discoloration in your eyes may be a sign of more serious disease and should be examined as soon as possible."
Is Pink Eye Contagious?,"Viral conjunctivitis is highly contagious. Viral conjunctivitis usually starts in one eye then spreads to the other. Avoid spreading pink eye by practicing good hygiene such as washing hands, disinfecting high-touch surfaces (e.g. doorknobs or countertops), and not sharing personal items, such as utensils, clothes, or towels."
How Long Is Pink Eye Contagious?,"Conjunctivitis is contagious while the eye is red (typically five to seven days). It is no longer contagious once redness or other symptoms have resolved. If your symptoms are mild, you may try home treatment or visit with your primary care physician. If your symptoms do not improve in one to two weeks, we recommend seeing one of our ophthalmologists. If symptoms are severe, see an ophthalmologist within one to two days. Our ophthalmologists will evaluate your symptoms, provide a diagnosis, and recommend proper treatment. We may also suggest further testing to determine the type of pink eye you have or rule out other diseases of the eye. Conjunctivitis is usually painless and does not affect vision. See an eye care specialist immediately if you experience intense pain, light sensitivity, or decrease in vision. Treatment for conjunctivitis focuses on relieving uncomfortable symptoms. Your treatment may vary depending on the type of conjunctivitis you have. One of our ophthalmologists may recommend: using artificial tears; applying cold or warm compresses (wet or dry) to your eye several times a day; taking a break from wearing contact lenses; antibiotics for bacterial pink eye (e.g. eye drops, oral medication, or cream); or antihistamines or."
What Is a Stye?,"A stye is a red, painful, pimple-like bump that forms on the eyelid or eyelash line. When one of the oil glands at the edge of your eyelid becomes infected, a stye may develop on the inside or outside of the eyelid. Styes can happen at any age from newborns to older adults."
Why Choose Moran Eye Center?,"TheMoran Eye Centeroffers accessible, nationally ranked care for our patients. Our team of ophthalmologists provides comprehensive eye care with multiple locations to best suit your needs. As the only academic ophthalmologic institution in the state, we have a strong reputation of trust and service across all ages and many levels of care. Our specialists have the expertise and equipment to treat any eye condition, from minor irritation to more advanced eye disease. If you have a stye, you may notice: a painful red bump along the edge of the eyelid or lash line; swelling around the bump, which sometimes affects the entire eyelid; pus at the center of the bump; scratchy feeling or feeling like something is in your eye; light sensitivity; crustiness along the lid and lash line; or excessive tearing (watery eyes). Try to avoid scratching your stye, as that may damage your skin or the soft tissue of your eye."
How Do You Get a Stye?,"Styes are caused by a clogged or infected oil gland in your eyelid. You may be at increased risk for a stye if you: experience blepharitis (chronic eyelid inflammation); have skin conditions such as acne, rosacea, or seborrheic dermatitis; have diabetes; are going through hormonal changes; or have increased lipid levels associated with high cholesterol."
Are Eye Styes Caused by Stress?,"Styes are not caused by stress, diet, or hygiene."
Why Do I Keep Getting Styes?,Recurrent styes may be due to chronic conditions such as blepharitis (clogged oil ducts) or rosacea. Your ophthalmologist can help determine any underlying causes and recommend the correct treatment.
Are Styes Contagious?,"Styes are not contagious. However, in rare instances, bacteria may spread between others if common items like towels or pillowcases are shared. If your symptoms are mild, you may try home treatment, or visit your primary care physician. See one of our ophthalmologists within one week if your stye has worsened or symptoms become severe. If symptoms are severe, see an ophthalmologist within one to two days. Your ophthalmologist will conduct an eye exam and evaluate your symptoms to determine if more advanced treatment is necessary. See an ophthalmologist right away if: your eye swells shut, your pain or swelling increases after two to three days, blisters form on your eyelid, your eyelid feels hot, or you experience substantial changes in vision. Styes frequently recur. Your ophthalmologist may recommend a small biopsy (tissue sample) of the stye to rule out underlying medical conditions.  If you frequently develop styes, your ophthalmologist may prescribe an antibiotic to further treat and prevent recurrences. In severe or long-lasting (over three weeks) cases, your ophthalmologist may also recommend an in-office procedure to drain your stye. Our clinicians are trained to properly drain a stye without damaging your eye or surrounding tissue."
