Question,Answer
Optometrist vs. Ophthalmologist: What’s the Difference?,"Optometrist Ophthalmologist Optician Bottom line An optometrist treats your eyes. In contrast, an ophthalmologist focuses on doing surgical procedures for eye conditions, while an optician helps you fit eyeglasses and other vision-correcting devices. If you’ve ever had to search for an eye care doctor, you’re likely aware that there are several different types of eye specialists. Optometrists, ophthalmologists, and opticians are all professionals who specialize in eye care. In this article, we will explore the education requirements, salary, scope of practice, and services that optometrists, ophthalmologists, and opticians provide. We will also discuss how to choose the best eye-care professional..."
What is an optometrist and what do they do?,An optometrist is the primary health care provider for routine eye care.
What is an ophthalmologist and what do they do?,An ophthalmologist is a medical doctor who specializes in surgical eye procedures.
What Are the Job Duties of an Optometrist?,"When someone starts having vision trouble, they see an optometrist for basic vision care. Optometrists do routine vision checks and tests, examine other parts of the visual system and diagnose and treat minor eye problems, diseases and injuries. If necessary, the optometrist prescribes glasses or contact lenses, finding the right vision correction level and fit for each person. They also do minor surgical procedures, offer pre- and post-op care for more involved surgeries with an ophthalmologist and promote general eye health and care."
How Do the Job Duties of an Ophthalmologist Differ From an Optometrist?,"Ophthalmologists can do all the above duties that optometrists can, as well as perform eye surgery. They have the additional skills to specialize in surgery for conditions like glaucoma and cataracts. They also perform corneal, vitro-retinal, eye muscle and oculoplastic surgeries. Before surgery even takes place, the ophthalmologist puts the patient through a complete exam to diagnose the issue and create the best treatment plan. An ophthalmologist can also treat more complicated eye injuries, including those dealing with other eye structures like the cornea, sclera, conjunctiva and eyelids."
Where Do Optometrists and Ophthalmologists Work?,"Many optometrists own their practices, sometimes working in a practice with other optometrists. Some optometrists only work with a certain population, specializing in one type of eye care such as pediatrics or low vision. Optometrists also find employment in postsecondary education, as consultants and in research roles. Ophthalmologists work in mostly in hospitals and surgery centers, but some also have their own practices. Both generally work full-time, putting in hours in the evenings and on the weekends to fit patient schedules."
What Is the Average Optometrist Salary?,"According to the U.S. Bureau of Labor Statistics, the median annual wage for optometrists was$110,300, as of May 2017. This means that half of the industry made more and half made less. Those in the top 10 percent of earners made$190,090, while the bottom 10 percent brought home less than$53,740. Optometrists employed in private doctor practices made the most at$124,060, while those in government roles made the least at$94,280. These states have the highest averageeye doctor salary: Connecticut ($192,870). Alaska ($187,800). Maryland ($141,870). Oklahoma ($136,740). Massachusetts ($135,780)."
What Is the Average Ophthalmologist Salary?,"Ophthalmologists earn an average of$357,000a year, according to the Medscape Ophthalmologist Compensation Report from 2018. The salary for self-employed ophthalmologists is$429,000, higher than the salary for those working for other entities, which is an average of$256,000. More years of experience generally equals higher pay. Those with 0 to 5 years of experience earn an average of$180,000, while 20-plus years of experience gets you about$270,000a year."
What Are the Symptoms of Glaucoma?,"The most common type of glaucoma is primary open-angle glaucoma. It has no signs or symptoms except gradual vision loss. For that reason, it’s important that you go to yearly comprehensive eye exams so your ophthalmologist, or eye specialist, can monitor any changes in your vision. Acute-angle closure glaucoma, which is also known as narrow-angle glaucoma, is a medical emergency. See your doctor immediately if you experience any of the following symptoms: severe eye pain nausea vomiting redness in your eye sudden vision disturbances seeing colored rings around lights sudden blurred vision"
What Causes Glaucoma?,"The back of your eye continuously makes a clear fluid called aqueous humor. As this fluid is made, it fills the front part of your eye. Then, it leaves your eye through channels in your cornea and iris. If these channels are blocked or partially obstructed, the natural pressure in your eye, which is called the intraocular pressure (IOP), may increase. As your IOP increases, your optic nerve may become damaged. As damage to your nerve progresses, you may begin losing sight in your eye. What causes the pressure in your eye to increase isn’t always known. However, doctors believe.................."
What Are the Types of Glaucoma?,Five major types of glaucoma exist. These are:
Who Is at Risk of Glaucoma?,"According to theWorld Health Organization(WHO), glaucoma is the second leading cause of blindness around the world. The risk factors for glaucoma include:"
How Is Glaucoma Diagnosed?,"To diagnose glaucoma, your ophthalmologist will want to perform a comprehensive eye examination. They’ll check for signs of deterioration, including loss of nerve tissue. They may also use one or more of the following tests and procedures:"
How Is Glaucoma Treated?,"The goal of glaucoma treatment is to reduce IOP to stop any additional eyesight loss. Typically, your doctor will begin treatment with prescription eye drops. If these don’t work or more advanced treatment is needed, your doctor may suggest one of the following treatments:"
Will a Person with Glaucoma Go Blind?,"If your increased IOP can be stopped and the pressure returned to normal, vision loss can be slowed or even stopped. However, because there’s no cure for glaucoma, you’ll likely need treatment for the rest of your life to regulate your IOP. Unfortunately, vision lost as a result of glaucoma cannot be restored."
Can Glaucoma Be Prevented?,"Glaucoma can’t be prevented, but it’s still important to catch it early so you can begin treatment that will help prevent it from getting worse. The best way to catch any type of glaucoma early is to have an annual preventive eye care appointment. Make an appointment with an ophthalmologist. Simple tests performed during these routine eye checks may be able to detect damage from glaucoma before it advances and begins causing vision loss. Last medically reviewed on  January 29, 2016"
What causes crossed eyes?,"Crossed eyes occur either due to nerve damage or when the muscles around your eyes don’t work together because some are weaker than others. When your brain receives a different visual message from each eye, it ignores the signals coming from your weaker eye. If your condition isn’t corrected, you may lose vision in your weaker eye. Crossed eyes are common in children. Often the underlying cause is unknown. Infantile esotropia is a type of crossed eyes that appears in babies during their first year of life. Esotropia runs in families and usually requires surgery to correct. Acquired esotropia occurs......"
How is crossed eyes diagnosed?,"To prevent vision loss, early diagnosis and treatment for crossed eyes is important. If you develop symptoms of crossed eyes, make an appointment with an eye doctor. They’ll perform a series of tests to check the health of your eyes that may include: a corneal light reflex test to check for crossed eyes avisual acuity testto determine how well you can read from a distance a cover/uncover test to measure your eye movement and deviation a retina exam to examine the backs of your eyes If you have other physical symptoms along with crossed eyes, your doctor may examine your......"
Who is at risk of crossed eyes?,"You’re more likely to develop crossed eyes if you: have family members who have crossed eyes have a brain disorder or brain tumor have had a stroke or brain injury have a lazy eye, are farsighted, or have vision loss have a damaged retina havediabetes"
How are crossed eyes treated?,"Your recommended treatment plan for crossed eyes will depend on the severity and underlying cause of your condition. If your crossed eyes have resulted from a lazy eye, your doctor may have you wear a patch over your stronger eye to force the muscles of your weaker eye to work harder. Your doctor might also prescribe eye drops to blur the vision in your stronger eye. They can also useBotox injectionsto weaken the muscle that’s overacting and causing the eye turn. Other potential treatments include: eye exercises corrective lenses, such as eyeglasses or contact lenses surgery on certain eye muscles,......"
What is the long-term outlook for crossed eyes?,"Often crossed eyes can be corrected with corrective lenses, eye patches, surgery in rare cases, or by other modalities. It’s important to seek treatment right away to lower your risk for vision loss. After you’ve received treatment, watch your eyes for changes. In some cases, the condition may come back. If your crossed eyes are caused by an underlying medical condition, early diagnosis and treatment may help improve your chances of recovery. Ask your doctor for more information about your specific condition and treatment options. Last medically reviewed on  August 20, 2019"
What is a doctor of optometry/optometrist?,"Doctors of optometry (O.D.s/optometrists), America’s primary eye health care providers, are the frontline of eye and vision care. Doctors of optometry are essential health care providers and are recognized as physicians under Medicare. They examine, diagnose, treat and manage diseases and disorders of the eye. In addition to providing eye and vision care, they play a major role in an individual’s overall health and well-being by detecting systemic diseases, and diagnosing, treating and managing ocular manifestations of those diseases, and providing vaccinations. Doctors of optometry: Prescribe medications, low vision rehabilitation, vision therapy, spectacle lenses, contact lenses and perform certain surgical............"
What is a comprehensive eye exam?,"Acomprehensive eye examconducted by a doctor of optometry determines the eye and vision health of a patient. During the exam, the doctor checks not only visual acuity through refraction but also the health of your eyes, eye tissue and other diseases. Each patient's symptoms, along with the doctor of optometry’s professional judgment, will determine what tests are conducted."
Why is it important to get comprehensive eye exams with a doctor of optometry?,"An in-person, comprehensive eye exam with a doctor of optometry is the medically recognized standard to assure precise and healthy vision, identify and treat diseases, such as glaucoma, a leading cause of blindness. In addition, eye exams safeguard overall health by enabling the doctor todetect more than 270 serious health conditionsincluding diabetes, high blood pressure, autoimmune diseases and cancers. In fact, in 2018 alone, doctors of optometry identified signs of diabetes in more than 301,000 patients who did not know they had the condition. In-person, comprehensive eye exams are one of the most important, preventive ways to preserve vision and..."
What is the difference between a comprehensive eye exam and a vision screening?,"Current vision screening methods cannot be relied on to effectively identify individuals who need vision care. These types of screenings are offered at schools, pediatrician offices or at the DMV. While they may uncover some vision problems, they can miss more than they find. In some cases, vision screenings can give a false sense of security for those individuals who ""pass"" the screening and inhibit the early diagnosis of vision problems. These people are then less likely to receive treatment for their vision problem and it could become worse. A comprehensive eye exam includes a range of tests in order..........................."
Eye Numbing Drops: Why Are They Used and Are They Safe?,"Types Uses Side effects Application and precautions Over-the-counter Summary Medical professionals use eye numbing drops to block the nerves in your eye from feeling pain or discomfort. If you’re pregnant or nursing, tell your doctor before getting eye numbing drops. Eye numbing drops are considered atopical anesthetic. They’re used duringeye examsand for surgical procedures involving your eyes. It’s important to understand the distinction between eye numbing drops (used for surgical procedures and eye exams) and other types ofeye drops. Saline drops, artificial tears, and anti-allergy or anti-histamine drops are available over-the-counter to soothe and hydrate your eyes. Antibiotic eye drops......"
Can I buy eye numbing drops over the counter?,"Eye numbing drops are not available over the counter. These drops should only be applied under the supervision of a medical professional to avoid serious side effects and, in some cases,chemical dependency."
How does astigmatism affect my vision?,"Astigmatismis a common vision condition that causes blurriness or distorted vision. It can affect the way light refracts on the retina. On a prescription, this will be written as part of the cylindrical (CYL) correction. If you see no number under CYL, it means you have no astigmatism, or the astigmatism is so slight you don’t need to correct it."
What is 20/20 vision?,"20/20 vision means you have normal visual acuity (or sharpness and clarity) at a distance of 20 feet away. It doesn’t mean perfect vision, though. It only means you can see clearly at a distance. Overall visual ability also measures: peripheral or side vision eye coordination depth of perception focusing ability color vision 20/15 vision is actually better than 20/20. Someone with 20/15 vision can see objects at 20 feet away that someone with 20/20 can only see at 15 feet away. The higher the second number, the less clear and sharp you’ll see objects at a distance. Someone with......"
Will your vision get worse?,"Vision doesn’t worsen as a result of getting older, but your risk for eye-related conditions and diseases does get increase as you age. For example, you’re at a higher risk for the following after age 50: age-relatedmacular degeneration cataracts glaucoma diabetic retinopathy For better eye health, you can try the following in addition to eating ahealthy dietand exercising regularly: wear sunglasses and a brimmed hat when you’re out in bright sunshine wear protective eyewear when playing sports, or using power tools or chemicals maintain ahealthy blood pressure"
How often should you get your eyes checked?,"Your prescription can change, so it’s important to get regular eye exams. Adults ages 19 to 40 with vision problems should get their eyes checked at least every two years. Adults older than 40 should get them checked once a year. If you’re an adult with no vision problems, get your eyes checked every five years until age 30, and then at least every 2 to 4 years from age 40 to 65. After age 65, you’ll need regular eye exams at least every two years. Let your doctor know if you notice any changes to your vision and need......"
How Long Does It Take for the Effects from Eye Dilation Drops to Wear Off?,"Side effects Purpose Tips Eye health Takeaway Getting your eyes dilated is an important part of any complete eye exam. Once your doctor puts in the dilating drops, it takes about 20–30 minutes for your pupils to fully open, or dilate. After your eyes are fully dilated, the effects will last for four to six hours for most people. Some people feel the effects of dilating drops for longer, including people with lighter color eyes. Dilation in children can last up to a full day after the exam. It’s impossible for your doctor to tell you exactly how long the..."
What are the side effects of eye dilation drops?,"Dilation is harmless in the long term, but it does come with short-term side effects. These will usually last for about four to six hours. Side effects of dilation include: light sensitivity blurry vision trouble focusing on close objects stinging right after the drops are put in If you wear contact lenses, you may not be able to wear them until the dilation drops wear off."
Why is eye dilation important?,"Dilation allows an eye doctor to look inside your eyes. Dilating drops widen the pupil (the black part of your eye) so that it doesn’t get smaller when your doctor shines a light at it. The widened pupil allows your doctor to use a magnifying lens to look inside your eye and at the back of your eye. They’ll look at the retina, optic nerve, blood vessels, and other parts of your eye that can’t otherwise be seen. Dilation helps your eye doctor diagnose many eye conditions, including glaucoma retinal detachment age-relatedmacular degeneration diabetic retinopathy It also helps diagnose some..."
What’s the Difference Between PRK and LASIK?,"How they work Recovery Efficacy Risks Candidate Cost Pros and cons Finding a provider Takeaway PRK vs. LASIK Photorefractive keratectomy (PRK) and laser-assisted in situ keratomileusis (LASIK) are both laser surgery techniques used to help improve eyesight. PRK has been around longer, but both are still widely used today. PRK and LASIK are both used to modify thecorneaof your eye. The cornea is made up of five thin, transparent layers of tissue over the front of your eye that bend (or refract) and focus light to help you see. PRK and LASIK each use different methods to help correct your........................"
What happens during LASIK?,"You’re given drops to numb your eye tissues. A small flap is cut into the epithelium using a tool called a femtosecond laser. This allows your surgeon to move this layer to the side while the other layers are reshaped with lasers. Because it remains attached, the epithelium can be put back in its place after the surgery’s done, rather than being fully removed as it is in PRK. An excimer laser is used to reshape corneal tissues and fix any issues with eye curvature. The flap in the epithelium is put back in its place over the rest of..."
What causes your eye to hurt when you blink?,"Common causes for eye pain when you blink include dry eyes, a stye, or pink eye (conjunctivitis). More serious conditions that can cause your eye to hurt when you blink include glaucoma or optic neuritis."
What is an ophthalmologist?,"Ophthalmologists are medical doctors with additional specialist training in the diagnosis and management of disorders of the eye and visual system. They are also sometimes called eye doctors or eye surgeons. In Australia, ophthalmologists need to complete at least 5 years of specialist training after they become a doctor. If you have an eye disease or visual disorder, your doctor or optometrist may refer you to an ophthalmologist. Ophthalmologists do surgery and prescribe contact lenses and glasses as well as medicines for eye problems."
What does an ophthalmologist do?,"Ophthalmologists are surgeons, and can do: cataract surgery, in which they replace the lens in your eye refractive or laser surgery, which involves reshaping your cornea to correctshort-sightedness,long-sightednessorastigmatism surgery to correct misalignment of your eyes, orstrabismus surgery to removecancers, such as melanoma, from the eye treatment to repair damage caused by an eye injury"
When do I see an ophthalmologist?,"Your doctor or optometrist may refer you to an ophthalmologist if you have: partial or complete loss of vision eye injuries, pain or inflammation eye conditions, such asglaucoma health conditions that can affect your eyes, includingdiabetesorhigh blood pressure poor vision that needs specialist care"
What questions should I ask an ophthalmologist?,"Before you go to your first appointment, note down any questions you have. During the consultation, ask for clarification if you don’t understand what is said. ASK YOUR DOCTOR— Preparing for an appointment? Use theQuestion Builderfor general tips on what to ask your GP or specialist."
How do I find an ophthalmologist?,"Ask your doctor or optometrist for a recommendation or use the healthdirect service finder to locate an ophthalmologist in your area. The RANZCOfind an ophthalmologisttool also allows you to search for an ophthalmologist who has a special interest, such as paediatric (children’s) ophthalmology. FIND A HEALTH SERVICE— TheService Findercan help you find doctors, pharmacies, hospitals and other health services."
Do I need a referral to see an ophthalmologist?,"It is important to get areferralfrom your doctor or optometrist to see an ophthalmologist. This is so that they can pass on useful important health information, and the ophthalmologist can later tell the doctor or optometrist about the results of your visit and any tests performed. If you don’t have a referral, neither Medicare nor private health insurance will contribute to the cost of your care. In an emergency, such as an eye injury or sudden loss of vision, go to the emergency department of your nearest hospital immediately, or call triple zero (000) and ask for an ambulance."
How much will an ophthalmologist cost?,"Thecostsof an ophthalmologist visit vary greatly, depending on the type of care you receive. Factors include whether it’s inhospital, whether you haveprivate health insurance, and what the ophthalmologistcharges."
"Optometrists, orthoptists and ophthalmologists: What’s the difference?","Optometrists are different from ophthalmologists. They can prescribe and fit glasses and contact lenses. They are also trained in screening for serious eye conditions such as glaucoma, but they are not doctors. Optometrists can give advice on visual problems and treat minor eye problems but will refer you to an ophthalmologist for the diagnosis and treatment of more serious eye conditions. Like optometrists, orthoptists are not doctors. They are allied healthcare professionals who specialise in assessing and managing eye movement disorders, such as double vision and squints (strabismus) in children and adults. Their role includes caring for people with eye......"
Why is cataract surgery performed?,"A cataract is an eye condition where the lens of your one or both of your eyes becomes cloudy. Cataractscan make your sight become blurry. If you have cataracts, you may also: be sensitive to bright lights see everything as slightly faded or yellow Cataracts will not get better on their own. The treatment for cataracts is surgery on your affected eye."
Who does cataract surgery?,Cataract surgery is performed by anophthalmologist(specialist eye doctor). Your doctor or optometrist can help you tofind the right health professionalfor cataract treatment.
What happens during cataract surgery?,"On the day of the surgery, you will be given eye drops that include anantibiotic. You might be given an injection around your eye or eye drops to make the eye go numb. Most people have alocal anaesthetic and light sedation. During the procedure you will be asked to lie on your back. The doctor will make a small cut in your eye. This lets them remove your cloudy lens and insert the plastic lens. The operation usually takes less than 30 minutes. There will always be medical staff to talk to during the procedure. If you have any problems,......"
What are the risks of having cataract surgery?,"Problems with cataract surgery are uncommon. Some people have bleeding, an infection or damage to their eye. If you notice any of the following, contact your eye specialist or go to the emergency department: your eye becoming red and painful fluid coming from your eye your sight getting worse"
Are there alternatives to cataract surgery?,"During the early stages of cataracts, you may find that new glasses, improved lighting or other visual aids help. If your cataracts start to make everyday activities difficult, surgery is the best treatment."
What is short-sightedness?,"Short-sightedness (also known as myopia) is a common eye condition that causes distant objects to appear blurred. Someone with myopia can achieve good vision with prescription glasses, contact lenses or laser surgery. Short-sightedness usually first appears in childhood."
How is short-sightedness caused?,"When light entersthe eye, it is bent by the cornea (the clear layer on the front of the eye) and the lens. If you have normal vision, the light waves are brought into focus right on the retina, the layer at the back of the eye. If you are short-sighted, the light waves from distant objects focus in front of, rather than on, the retina. Short-sightedness usually appears in the pre-teen years and often gets worse for a few years. It can also develop later — even in early adulthood. It is becoming more common. Myopia has been linked to......"
How is short-sightedness diagnosed?,An eye test using an eye chart will allow an optometrist or ophthalmologist to diagnose short-sightedness. Children should have their vision checked when they start both primary and secondary schools.
