Question,Answer
Want to find out more about your eyes?,"As the profession’s peak body,Optometry Australia represents the largest community of optometrists in Australia. Since 1918 we have united the sector to make Australia a world leader in the delivery of vision and eye health services and patient care. We recognise that our past was, and our future remains, a mutual collaboration involving us, our members and sector partners. In the spirit of reconciliation Optometry Australia acknowledges the Traditional Custodians of country throughout Australia and their connections to land, sea and community. 
			We pay our respects to their Elders past and present and extend that respect to all Aboriginal and Torres Strait Islander peoples today. Our organisation Latest updates Media releases Contact us Facebook Twitter LinkedIn Instagram YouTube Membership benefits Join today Privacy policy Terms & conditions Disclaimer Good vision for life FAQs © Optometry Australia 2024 |Web design & development by Juuce"
What is uveitis?,"Uveitis is inflammation that occurs in the eye. Inflammation is normally one of the body’s protective responses to infection or injury, but in diseases such as uveitis, uncontrolled inflammation can cause damage. Uveitis is the most common eye problem associated with juvenile idiopathic arthritis (JIA). Uveitis is more common in children who have a positive anti-nuclear antibody (ANA)."
What are the symptoms of uveitis?,"There are different kinds of uveitis associated with JIA. The most common form of uveitis has no symptoms (‘silent uveitis’), which is why regular eye check ups are essential. However your child may complain of blurring of vision, sensitivity to light, and, rarely, eye redness or pain. If left untreated, uveitis can result in loss of vision."
What causes uveitis in JIA?,"The immune system, which usually fights infections, attacks the inner part of the eye. No one knows why this occurs in JIA patients."
How is uveitis diagnosed?,"As there may be no symptoms, all children with JIA need to be regularly assessed by an ophthalmologist (specialist eye doctor). The ophthalmologist will look into the back of your child’s eyes with a special microscope called a slit lamp. Some children may be assessed by an optometrist, particularly older children (e.g. over 8 years of age). How often each child needs to be seen will be decided by their ophthalmologist or optometrist. For children without uveitis they may be seen initially every three months then over time this may extend to less often (e.g. six monthly). Children with active uveitis may need to be seen much more often by an ophthalmologist but your child’s doctor will direct this plan."
How is uveitis treated?,"If uveitis occurs, the ophthalmologist and rheumatologist will work together to treat your child to prevent permanent eye damage. Treatment may require steroid eye drops. Sometimes other eye drops are required. If the eye drops don’t control the uveitis or the uveitis is severe, your child may require other medicines by mouth or injection. These medicines aim to suppress their immune system and may include methotrexate and TNF blockers. Some children who develop complications of severe uveitis may require eye surgery to improve their vision and protect their eyes."
What is retinal detachment?,"Retinal detachment occurs when the retina, the light-sensitive nerve tissue lining the inside of the eye, becomes separated from where it is normally attached at the back of the eye. When this happens, the retina stops functioning, causing loss of vision. The retina is responsible for converting light into nerve impulses that are then sent along the optic nerve to the brain. Retinal detachment is a medical emergency. If not treated properly, it can lead to permanent blindness in the affected eye when the retina becomes permanently detached. Although retinal detachment is rare, affecting 1 in 10,000 Australians every year, the consequences can be catastrophic loss of sight, so if you have symptoms of retinal detachment, such as sudden onset of floaters or flashes, you should contact an eye specialist (ophthalmologist) or your doctor immediately. This could save your sight. Retinal detachment may start with tears or holes in the retina – if these aren’t treated they may lead to retinal detachment. Symptoms of retinal detachment may include: Sudden onset of, or a sudden increase in,‘floaters’(dark moving specks or ‘cobwebs’) andflashes(momentary flashes of light like a camera flash or lightning bolt) that appear in your vision. Sudden deterioration in, or."
Does your child need to see a health professional about lazy eye symptoms?,"Yes. If you notice that your child has any of the signs above or you’re worried about your child’s vision, start by seeing yourGPorchild and family health nurse. They can refer your child to anoptometristorophthalmologistif your child needs more tests and checks. If your child is referred to an optometrist or ophthalmologist to test for lazy eye, this professional will carefully examine your child’s eyes and vision to diagnose lazy eye and work out what’s causing it. Lazy eye diagnosis involves various tests and tools. For example, the optometrist or ophthalmologist: will check your child’s vision using an eye chart that has letters or symbols on it might use medication like eye drops to measure the focus of your child’s eyes might use equipment like a retinoscope to work out whether glasses might help your child’s lazy eye. Early diagnosis and treatment of lazy eye is essential. The earlier lazy eye is treated, the better the outcomes are for children. If lazy eye is left untreated, it can cause permanent vision loss. Lazy eye in children can usually be corrected with the right treatment. Treatments for lazy eyeaim to strengthen the lazy eye and get it working properly. The specific."
What is astigmatism?,"Astigmatism is a type of refractive error where the front surface of the eye (the cornea) or the lens inside the eye has an irregular curvature which causes the vision to be distorted and blurred. For example, instead of having a round, spherical curvature like a basketball, the cornea may be elongated like a rugby ball. Light rays entering an astigmatic eye are bent unevenly. As a result, these rays do not focus at a single point on the retina, causing some parts of the image to be more out of focus than others. There are a number of different types of astigmatism. These include: simple; compound; mixed; regular; irregular; corneal; and lenticular. Astigmatism often occurs with near-sightedness (myopia) and far-sightedness (hypermetropia). The exact cause remains unknown; however, some common types of astigmatism seem to run in families and may be inherited. It is thought that most people have some form of astigmatism as it is rare to find perfectly shaped curves in the cornea and lens, but the defect is rarely serious. Keratoconus is a condition in which the cornea is highly astigmatic and may cause severely distorted vision. Blurred or distorted vision, eye strain and headaches are possible."
What Is the Antineutrophil Cytoplasmic Antibodies (ANCA) Test?,"An antineutrophil cytoplasmic antibodies test is a blood test that helps distinguish ulcerative colitis from Crohn's. Newly Diagnosed with Ulcerative Colitis?With ulcerative colitis, you’ll want to know what could happen and how to handle it."
What Is Glaucoma?,"Glaucoma is a condition that damages your eye's optic nerve, and it gets worse over time. It's often linked to a buildup of pressure inside your eye. Glaucoma tends to run in families. You usually don’t get it until later in life. The increased pressure in your eye, called intraocular pressure, can damage your optic nerve that sends images to your brain. If the damage worsens, glaucoma can cause permanent vision loss or even total blindness within a few years. What glaucoma looks like within the eye. Most people with glaucoma have no early symptoms or pain. Visit your eye doctor regularly so they can diagnose and treat glaucoma before you have long-term vision loss. If you lose vision, it can’t be brought back, but lowering eye pressure can help you keep the sight you have. Most people with glaucoma who follow their treatment plan and have regulareye examsare able to keep their vision. The fluid inside your eye, called aqueous humor, usually flows out of your eye through a mesh-like channel. If this channel gets blocked or the eye is producing too much fluid, the liquid builds up. Sometimes, experts don’t know what causes this blockage, but it can."
What Is Pink Eye?,"Conjunctivitis, also known as pink eye, is aninflammationof the conjunctiva -- the thin, clear tissue that lies over the white part of theeyeand lines the inside of the eyelid. Pink eye can be contagious and is often associated with children, but anyone can get it. Treatment will depend on whether your pink eye is due to a virus, bacteria, allergies, or an irritating substance. (Photo Credit: iStock/Getty Images) Pink eye causes redness, itching, pain, burning, discharge, and swelling in and around the eyes. It might make your vision blurry and make you sensitive to light, but you’ll still be able to see. Pink eye can happen to anyone, regardless of age, but it's common in children. It can be highly contagious, spreading rapidly in schools and day-care centers, but it’s rarely serious. It's unlikely to damage your vision, especially if you find and treat it quickly. When you take care to prevent its spread and do everything your doctor suggests, pink eye clears up with no long-term problems. What does pink eye look like?"
What does pink eye look like?,"Pink eye looks like the whites of one or both eyes are pink or red. You may have swelling around your eyes and could see white, yellow, or green discharge. Pink eye vs. stye Stye and pink eye are eye infections with similar symptoms. Like pink eye, symptoms of a stye include itchy, sore, and watery eyes and sensitivity to light. But unlike conjunctivitis, a stye causes a small pus-filled bump in the upper or lower eyelid. It also happens due to a bacterial infection, most commonlyStaphylococcus aureusandStaphylococcus epidermidis."
How Do You Get Pink Eye?,"Several things could be to blame, but the most common causes of pink eye are: Viruses, including the kind that causes the common cold Bacteria Allergens such as pollen, dust, or smoke. It could also be due to a special type of allergy that affects some people who wearcontact lenses. Other causes include: Irritants such as shampoos, dirt, smoke, and pool chlorine A reaction to eye drops A reaction to wearing contact lens Fungi, amoebas, and parasites Conjunctivitis sometimes results from anSTD.Gonorrheacan bring on a rare but dangerous form of bacterial conjunctivitis. It can lead to vision loss if you don’t treat it.Chlamydiacan cause conjunctivitis in adults. If you have chlamydia, gonorrhea, or other bacteria in your body when you give birth, you can pass pink eye to your baby through your birth canal. Pink eye, caused by some bacteria and viruses, can spread quickly from person to person. But it isn’t a serious health risk if diagnosed promptly. However, if it happens in a newborn, tell a doctor immediately, as it might be an infection that can affect the baby’s eyesight. Who is at risk for pink eye?"
Who is at risk for pink eye?,"Though pink eye can happen to anyone, newborn babies are at a higher risk of having it. You also may be more at risk if: You interact with someone who has pink eye. You just had a cough, cold, or other respiratory infection. You wear contact lenses. You’ve been exposed to an allergen. Pink eye and COVID-19 Pink eye may be the only symptom of COVID when the virus infects the eyes, according to a 2020 case report. But more research is needed, as it's rarely the sole COVID symptom. Most people with COVID show symptoms such as fever or chills, cough, tiredness, difficulty breathing, loss of taste or smell, sore throat, runny nose, vomiting, and body aches. Is pink eye contagious?"
Is pink eye contagious?,"Pink eye may be contagious, depending on the type. Cases caused by a viral or bacterial infection can spread to other people, but those caused by allergies or irritants don’t. Pink eye symptoms may be the same regardless of their cause. It's hard to know which type of conjunctivitis you have without your doctor testing it. So, regularly wash your hands and avoid touching your eyes to prevent spreading or catching it. Viral pink eye Viral pink eye is the most common and may be the most contagious form. It's usually caused by the virus that causes the common cold. It tends to start in one eye, causing lots of tears and a watery discharge. Within 24-48 hours, it affects the other eye, too. You might feel aswollen lymph nodein front of your ear or under your jawbone. You may also have cold symptoms such as a fever, sore throat, and runny nose. Viral pink eye has no cure but will go away on its own. Your symptoms may worsen in the first 3-5 days, but you’ll get better within 1-3 weeks. Bacterial pink eye Bacteria that cause pink eye include: Staphylococcus aureus Streptococcus pneumoniae Haemophilus influenzae Moraxella catarrhalis Chlamydia."
What Causes Dry Eyes?,"What Causes Dry Eyes? How Are Dry Eyes Treated? Even when you’re happy, your eyes are full of tears. They provide moisture and lubrication to help you see and keep your peepers comfortable. What’s in a tear? They’re a mix of: Water, for moisture Oils, for lubrication Mucus, for even spreading Antibodies and special proteins that keep infection at bay The ingredients come from special glands around your eye. Dry eyes often mean your tear system is out of whack. When tears don’t provide enough moisture, you might notice: A gritty feeling Feeling like there’s something in your eye Itching Redness Blurry vision Light sensitivity Sometimes, dry eyes create too many tears. This confusing condition is calledreflex tearing. It happens because the lack of moisture irritates your eye. It sends a distress signal through your nervous system for more lubrication. Your body sends a flood of tears to try to make up for the dryness. It’s a lot like what happens when you get sand in your eye and it runs. But these tears are mostly water, so they don’t act like normal tears. They can wash debris away, but they can’t coat your eye’s surface."
What Causes Dry Eyes?,"Sometimes, there's a lack of balance in your tear-flow system. Or your air conditioner, heater, or other things around you could dry out your tear film. Other causes include: The natural aging process, especially menopause Side effects of certain drugs likeantihistamines Diseases that affect your ability to make tears, like Sjogren's syndrome, rheumatoid arthritis, and collagen vascular diseases Problems that don’t allow your eyelids to close the way they should"
How Are Dry Eyes Treated?,"There are a number of options. Ask your eye doctor what to do. Treatments include: Artificial tear drops and ointments.This is the most common treatment. Many types of drops are available over the counter. No one product works for everyone, so you might have to try a few to figure out the one that’s right for you. If you havechronic dry eye, you need to use the drops even when your eyes feel fine, or they won’t stay wet enough. If your eyes dry out while you sleep, you can use a thick product, like an ointment, at night. You might think about sleeping with airtight goggles on. They'll create a mini ""moisture chamber"" for your eyes. Temporary punctal occlusion.Your doctor might opt to close the punctum, or duct that drains tears from your eye. They might start with a temporary plug designed to dissolve over time. Based on how it works, your doctor will know whether permanent plugs will help. Nondissolvingpunctal plugsand punctal occlusion by cautery (application of heat to tear exit duct).If temporary plugs work well, your doctor may move to longer-lasting ones or may go right to a long-lasting plug. Or they could choose a procedure called."
What Is a Stye?,"If you notice a bump that looks like a pimple on your upper or lower eyelid, it might be a stye. It's an infection in the oil glands around the eyelids and most often shows up next to your eyelashes. Usually, this red, painful bump filled with pus lasts a few days, then bursts and heals. But in some cases, you'll need treatment for the infection. You usually get a stye in one eye at a time. Some people get them repeatedly. Chalazion vs. stye A chalazion is a different kind of eyelid bump. It most often shows up on the underside of your upper eyelid. But you can get one on the lower lid, too. It's caused by blocked oil glands in your lid, not an infection. But it can sometimes form after a stye. Unlike a stye, it's usually not painful. Chalazia (the plural of chalazion) often last longer than styes, for weeks or months, but usually go away on their own. Stye vs. pink eye Pink eye, or conjunctivitis, is inflammation of the membrane lining your inner eyelid and the surface of your eyeball. The telltale sign is that the whites of your eye look reddish or."
What Is Astigmatism?,"Astigmatism is a condition in which your eye, especially your cornea or the clear front part of the eyeball, isn’t completely round. Almost all of us have some degree of astigmatism. Ideally, an eyeball is shaped like a perfectly round ball. Light comes into it and bends evenly, which gives you a clear view. But if your cornea is shaped more like a football, light gets bent more in one direction than another. That means only part of an object is in focus. Things at a distance may look blurry and wavy. It’s common to have astigmatism along withnearsightedness(myopia) orfarsightedness(hyperopia). These three conditions are called refractive errors because they involve how your eyes bend (or refract) light. Astigmatism is fairly easy for an eye doctor to fix with glasses, contacts, or surgery. Symptoms of astigmatismmay include: Blurry or distorted vision Eyestrain Headaches Trouble seeingat night Is astigmatism genetic?"
Is astigmatism genetic?,"Experts think the condition is genetic, meaning if you have it, you're more likely to pass it on to your children. Astigmatism happens when your cornea is irregularly shaped, bending light in one direction more than another and leaving only part of an object in focus. (Photo Credit: iStock/Getty Images) Most people are born with it, but experts don’t know why. You can also get it after an eye injury, an eye disease, or surgery. Rarely, a condition calledkeratoconuscan cause astigmatism by making the clear front part of your eye (your cornea) thinner and more cone-shaped. You’ll probably need contacts (but not glasses) to see clearly. You can’t get astigmatism from reading in low light or sitting too close to the TV. Astigmatism symptoms come on slowly. Go to aneye doctorif you notice changes in your vision.You’ll need a complete eye exam. Your doctor will test the sharpness of your eyesight by asking you to read an eye chart. Astigmatism tests Your doctor will also use tools to measure your vision, including: Phoropter.You look through a series of lenses to find the ones that give you the clearest vision. Keratometer.This machine measures the bend in the center of yourcornea. It."
What Is an Ophthalmologist?,"An ophthalmologist is a medical doctor who is able to treat complicated eye problems with surgery or other procedures. Ophthalmologists attend medical school. After that, they have a 1-year internship and a residency of 3 years. That's sometimes followed by a fellowship of 1-2 years. These eye doctors offer complete eye care services: Vision services, including eye exams. Medical eye care, for conditions likeglaucoma, iritis, and chemical burns Surgical eye care, for trauma, crossed eyes, cataracts, glaucoma, and other problems Diagnosis and treatment of eye conditions related to other diseases, like diabetes or arthritis Plastic surgery, to raise droopy eyelids or smooth out wrinkles In ophthalmology, there are several specialties. They include: Pediatric ophthalmology.These doctors treat eye problems in children. They can perform ophthalmic surgery on children who have crossed eyes orcataracts. They can treat retina issues that happen when babies are born early and inflammation that can cause vision loss, among other issues. Neuro-ophthalmology.This type of doctor deals with eye issues that are caused by problems in your brain or optic nerve. Those can include drooping eyes, uncontrolled blinking, migraines, and eyelid spasms. Ocular oncology.These are doctors who diagnose and treat cancers of the eye, the eyelid, and the."
What Is Eye Strain?,"Your eyes are burning, itchy, and tired. It’s a common condition but rarely serious. You can take simple steps to prevent or ease this problem. If those tactics don’t work, see your doctor. What you’re feeling could be a sign of a deeper condition that requires treatment. This is especially important if you have headaches or other problems like: Eye discomfort Double vision A big change in vision Your eyes might get tired easily if you stare for long periods at a computer, smartphone, or game console."
What Is LASIK Eye Surgery?,"LASIK, which stands for laser in-situ keratomileusis, is a popular surgery that can correctvisionin people who arenearsightedorfarsighted, or who haveastigmatism. It’s one of many vision correction surgeries that work by reshaping your cornea, the clear front part of youreye, so that light focuses on the retina in the back of your eye."
Why Is LASIK Done?,"When light doesn’t focus on your retina the way it should, yourvisionis blurry. Doctors call this a refractive error. The basic types include: Nearsightedness (myopia).You see things clearly when they’re close to you, but things farther away are blurry. Farsightedness (hyperopia).You see faraway things more clearly, but closer things are blurry. Astigmatism.This can make everything blurry because of how youreyeis shaped. Talk to your doctor about whether LASIK is right for you. You shouldn’t have the surgery if you: Are younger than 18 Arepregnantor nursing Take certainmedications Have a lot of recent changes to your vision prescription Have thin or uneven corneas Have eye conditions such asglaucomaor verydry eyes Have other health issues such asdiabetes,lupus, orrheumatoid arthritis The benefits of LASIK include: It’s been around for over 25 years. About 96% of patients reach their vision goals afterward. An enhancement can raise this number even more. There’s very little, if any,paininvolved. There aren’t any bandages orstitches. If your vision changes as you age, your doctor can adjust it. You probably won’t need to use glasses or contacts as much, or at all, after LASIK. As with any surgery, LASIK carries some risks, including: It’s a complex procedure. It’s rare, but."
Eye Pain: What Are the Causes?,"Where Does It Hurt? Common Eye Problems Other Symptoms Tests to Diagnose Eye Pain Treatments  Nearly everyone has had soreeyesat some point. Sometimes they get better on their own, but they can also be a sign of something more serious. Youreyedoctor can figure out what's going on and find the right treatment for you."
What Is Retinal Vein Occlusion?,"Eye Health News Eye Health Reference Eye Health Slideshows Eye Health Quizzes Eye Health Blogs Eye Health Videos Find an Ophthalmologist Vision Problems Common Eye Problems Pinkeye - Conjunctivitis Glaucoma Styes Pupil & Iris Problems Cataracts Macular Degeneration Eyelid Problems Children's Eye Health Ocular Migraines More Related Topics PoliciesPrivacy PolicyCookie PolicyEditorial PolicyAdvertising PolicyCorrection PolicyTerms of Use Privacy Policy Cookie Policy Editorial Policy Advertising Policy Correction Policy Terms of Use AboutContact UsCareersNewsletterWebMD AppCorporateWebMD Health ServicesSite Map Contact Us Careers Newsletter WebMD App Corporate WebMD Health Services Site Map For AdvertisersAdvertise with Us Advertise with Us    © 2005 - 2024 WebMD LLC, anInternet Brandscompany. All rights reserved. WebMD does not provide medical advice, diagnosis or treatment.See additional information."
What Kind of Inherited Retinal Dystrophy Do You Have?,"You may not know about inherited retinal dystrophy, but this group of eye disorders can steal your vision. Learn more them and how your genes play a role. If you have low vision, there are devices that can help. From simple magnifiers to text-to-speech gadgets, find out how technology can make life easier. What to know about disparities in retinal dystrophy research, diagnosis, treatment, and care and what they mean for you. Inherited retinal dystrophy can sap your sight. Here are steps you can take to make the most of your vision. Learn from an expert why genetic testing critical for diagnosis of inherited retinal dystrophy and how gene therapy is the wave of the future in treatment. See More on Eye Health From WebMD About WebMD Advertise With Us Terms of Use Privacy Policy Cookie Policy Editorial Policy Contact Us AdChoice   ©2005-2024 WebMD LLC. All rights reserved. WebMD does not provide medical advice, diagnosis or treatment.See additional information."
