Question,Answer
Why Is LASIK Done?,"When light doesn’t focus on your retina the way it should, yourvisionis blurry. Doctors call this a refractive error. The basic types include: Nearsightedness (myopia).You see things clearly when they’re close to you, but things farther away are blurry. Farsightedness (hyperopia).You see faraway things more clearly, but closer things are blurry. Astigmatism.This can make everything blurry because of how youreyeis shaped. Talk to your doctor about whether LASIK is right for you. You shouldn’t have the surgery if you: Are younger than 18 Arepregnantor nursing Take certainmedications Have a lot of recent changes to your vision prescription Have thin or........."
How Should I Prepare for LASIK Eye Surgery?,"Before LASIK, you’ll meet with a coordinator or eye surgeon who will talk about what to expect during and after the procedure. They’ll ask about your medical history and do a fulleye exam. This may include tests to measure the thickness of your cornea, refraction, and eye pressure. They may map your corneas and dilate your pupils. The surgeon will answer any questions you may have. Then, you can schedule an appointment for the surgery. If you use rigid gas-permeablecontact lenses, don’t wear them for at least 3 weeks before your evaluation. Don’t wear other types of contact lenses for......"
What Happens During LASIK Eye Surgery?,"Your doctor will give you drops to numb youreyes. You can also ask for a mild sedative. They’ll use an instrument called a microkeratome or a femtosecond laser to make a thin flap in your cornea. They’ll peel it back and use another laser to reshape the tissue underneath. Then, they’ll put the flap back in place, and the surgery is done. The LASIK procedure itself usually takes about 20 minutes. Plan to have someone drive you home after surgery."
What Should I Expect After LASIK Eye Surgery?,"Your eyes will be dry, even though they may not feel that way. Your doctor will give you prescription eyedrops to prevent infection andinflammation, as well as drops to keep your eyes moist. You might have a brief, slight burning feeling orblurry visionwhen you use them. Do not use any eyedrops without asking your doctor about them. Your eyes will probably heal very quickly. Most patients notice better vision within a few days. Call your doctor if you have any problems or unusual side effects. Don’t swim or use a hot tub for 2 weeks after surgery. You might get........."
Eye Pain: What Are the Causes?,"Where Does It Hurt? Common Eye Problems Other Symptoms Tests to Diagnose Eye Pain Treatments  Nearly everyone has had soreeyesat some point. Sometimes they get better on their own, but they can also be a sign of something more serious. Youreyedoctor can figure out what's going on and find the right treatment for you."
What Kind of Inherited Retinal Dystrophy Do You Have?,"You may not know about inherited retinal dystrophy, but this group of eye disorders can steal your vision. Learn more them and how your genes play a role."
What Is Retinal Vein Occlusion?,"Myths and Facts: Dry Eye DiseaseCertain myths persist that can delay the diagnosis and treatment of dry eye disease. Certain myths persist that can delay the diagnosis and treatment of dry eye disease. The Consequences of Not Treating Dry Eye DiseaseLeft untreated, dry eye disease can damage your eyes or worse. Left untreated, dry eye disease can damage your eyes or worse. At-Home Remedies for Dry Eye DiseaseFrom eye drops to warm compresses, these simple solutions help relieve dry, gritty eyes. From eye drops to warm compresses, these simple solutions help relieve dry, gritty eyes. Treatments for Thyroid Eye DiseaseYour...................................................................................................................................................................................................................................."
What Is an Ophthalmologist?,"*Apellis does not endorse or recommend any specific eye care professional included in this locator tool and does not control the information contained in the locator. Apellis is not responsible for the information provided by or actions of any physician listed. All content on the Academy’s website is protected by copyright law and theTerms of Service. This content may not be reproduced, copied, or put into any artificial intelligence program, including large language and generative AI models, withoutpermissionfrom the Academy. Contact Us About the Academy Jobs at the Academy Financial Relationships with Industry Medical Disclaimer Privacy Policy Terms of Service............"
Can You Believe Your Eyes?,"Explore how the eye-brain connection plays an important role in what you see, but can sometimes be tricked into seeing things that aren’t there. This virtual event was held in collaboration with vision scientists from theSmith-Kettlewell Eye Research Instituteand the 2020 virtualBay Area Science Festival.  Donate Now Donate Now   Museum of the Eye onFacebookTruhlsen-Marmor Museum of Eye"
What is the Truhlsen-Marmor Museum of the Eye®?,"The American Academy of Ophthalmology Truhlsen-Marmor Museum of the Eye is the world’s only free, public museum dedicated to the fascinating science of sight. Look through the pupil of an enormous eye, explore interactive displays and try on a virtual reality headset to see how new technology can impact medicine. Through high-tech exhibits and a renowned collection of ophthalmic artifacts, you’ll discover surprising facts about how your vision works and the field of medicine devoted to protecting it.Through innovative exhibits, school tours, and free resource materials, the museum promotes eye health on a broad scale."
What do EyeCare America patients say about us?,"All content on the Academy’s website is protected by copyright law and theTerms of Service. This content may not be reproduced, copied, or put into any artificial intelligence program, including large language and generative AI models, withoutpermissionfrom the Academy. Contact Us About the Academy Jobs at the Academy Financial Relationships with Industry Medical Disclaimer Privacy Policy Terms of Service Statement on Artificial Intelligence Help For Advertisers For Media Ophthalmology Job Center"
How Much Do You Know About Eye Health?,"Study after study has shown that people fear vision loss more than they fear cancer, stroke, heart disease and other serious ailments.But while most adults assume they're well versed in vision facts, few actually are. And that lack of knowledge only increases their risk.You might be surprised by these findings from anonline survey of 3,512 American adultsconducted by The Harris Poll for the American Academy of Ophthalmology.What You Don't Know about Eye Health Could Harm YouMost people are unaware of basic facts that could protect them from vision loss. For example, only about one-third of Americans know that eye diseases............"
Are You at Risk of Vision Loss?,"Did you know thatcertain groups have a higher riskof eye problems than others? If so, you're a step ahead of most adults.   If you're in a high-risk group, make sure to getregular eye examsso that your doctor can catch disease early. If you're worried about the cost of an eye exam,EyeCare Americacould help.   About one-third of Americans develop some form ofvision-reducing eye disease by age 65. But you might be surprised to know that vision loss is not always part of growing older.   Fortunately, there are steps you can take toprotect your eyes as you age."
What Is the Main Cause of Astigmatism?,Astigmatism is caused by acorneaorlensthat has a different shape than normal. Astigmatism is very common. Doctors don't know why the shape of the cornea or lens varies from person to person. But they do know the risk of getting astigmatism is inherited (passed down from parents). People can also get astigmatism from: eye disease eye injury or after surgery It is a myth that reading in low light or sitting very close to the television causes astigmatism or makes it worse.
How Does Astigmatism Affect Vision?,"Normally, the cornea and lens at the front of the eye have an evenly round shape. This helps focus light rays sharply onto the retina so you can see clearly. With astigmatism, light rays do not refract (or bend) properly as they enter the front of the eye. Vision is blurry at near and far because light rays either fall short of the retina or behind it. People may have astigmatism along with other refractive errors, such as: nearsightedness (myopia)or farsightedness (hyperopia). In a normal eye, the cornea and lens focus light rays on the retina, as shown below: In..."
How Can You Tell if You Have Astigmatism?,"Astigmatism symptoms may include: blurry vision or areas of distorted vision eyestrain headaches squinting to try to see clearly, or eye discomfort These symptoms do not always mean you have astigmatism. See your ophthalmologist for acomprehensive eye examto find out what is causing your symptoms. Children may not realize they have blurry visionand are unlikely to complain about blurred or distorted vision. But without treatment, astigmatism can: impact a child's performance in school and sports lead to amblyopia (lazy eye)and vision loss This is why early childhood eye screenings—by a pediatrician, family doctor or other eye care professional—are so important...."
How Is Astigmatism Corrected?,"Eyeglassesorcontact lenses.They work by refocusing light on the retina in the back of your eye so that you can see more clearly. There are two main types of contacts for astigmatism: toric soft lenses and RGP (rigid gas permeable). For more severe astigmatism, RPG lenses may work best. Refractive surgery.With LASIK and other procedures, a laser reshapes the cornea to adjust how light travels through it. There is no best way to correct your astigmatism—the most appropriate correction is one that best suits your vision needs and lifestyle. You and your ophthalmologist can discuss your options in more detail after..."
What Causes Red Eyes?,"Bloodshotorred eyeseyes are usually caused by an external irritant, called an allergen. Irritated eyes can look unpleasant, with pink or red streaks in theconjunctivaandsclera, which are usually white. Common symptoms that often go along with bloodshot eyes include: itchiness tearing burning These are some common eye irritants: pollen (hay fever) chlorine from swimming pools pets dust mold cigarette smoke perfumes To fight off the irritant, your eyes make a substance called histamine. Histamine dilates and inflames the tiny blood vessels under the eye’s surface. Many cases of red eye are harmless and respond well to home or over-the-counter treatments. The........."
What Are Cataracts?,"A cataract is when your eye's natural lens becomes cloudy. Proteins in your lens break down and cause things to look blurry, hazy or less colorful.In this article:Vision Problems with CataractsSymptoms of CataractsCauses of CataractsDiagnosing CataractsTreating CataractsInside our eyes, we have a naturallens. The lens bends (refracts) light rays that come into the eye to help us see. The lens should be clear, like the top lens in the illustration.Vision Problems with CataractsIf you have acataract, your lens has become cloudy, like the bottom lens in the illustration. It is like looking through a foggy or dusty car windshield. Things..........................."
What Causes Cataracts?,"Aging is the most common cause. This is due to normal eye changes that begin to happen after age 40. That is when normal proteins in the lens start to break down. This is what causes the lens to get cloudy. People over age 60 usually start to have some clouding of their lenses. However, vision problems may not happen until years later. Other reasons you may get cataracts include: having parents, brothers, sisters, or other family members who have cataracts having certain medical problems, such asdiabetes having had aneye injury, eye surgery, or radiation treatments on your upper body............"
"Once I have a cataract diagnosis, what should I do?","Have an eye exam every year if you're older than 65, or every two years if younger. Protect your eyes fromUV lightby wearingsunglassesthat block at least 99 percent UV and a hat. If you smoke, quit.Smokingis a key risk factor for cataracts. Use brighter lights for reading and other activities. A magnifying glass may be useful, too. Limit driving at night oncenight vision,halosor glare become problems. Take care of any other health problems, especiallydiabetes. Get the righteyeglassesorcontact lensesto correct your vision. When it becomes difficult to complete your regular activities, considercataract surgery. Make an informed decision about cataract surgery. Have.................."
How does cataract surgery work?,"Duringcataract surgery, your eye surgeon will remove your eye’s cloudy naturallens. Then he or she will replace it with an artificial lens. This new lens is called anintraocular lens (or IOL). When you decide to have cataract surgery, your doctor will talk with you aboutIOLs and how they work. People who have had cataract surgery may have their vision become hazy again years later. This is usually because the lens capsule has become cloudy. The capsule is the part of your eye that holds the IOL in place. Your ophthalmologist can use a laser to open the cloudy capsule and..............................................................."
What Is a Detached Retina?,"A detached retina is when theretinalifts away from the back of the eye. The retina does not work when it is detached, making vision blurry. A detached retina is a serious problem. An ophthalmologist needs to check it out right away, or you could lose sight in that eye."
How Do You Get a Detached Retina?,"As we get older,the vitreous in our eyesstarts to shrink and get thinner. As the eye moves, the vitreous moves around on the retina without causing problems. But sometimes the vitreous may stick to the retina and pull hard enough to tear it. When that happens, fluid can pass through the tear and lift (detach) the retina."
Who Is at Risk for a Retinal Detachment?,"You are more likely to have a detached retina if you: need glasses to see far away (are nearsighted) have hadcataract, glaucoma, or other eye surgery take glaucoma medications that make the pupil small (like pilocarpine) had a serious eye injury had a retinal tear or detachment in your other eye have family members who had retinal detachment have weak areas in your retina (seen by an eye doctor during anexam)"
How Is a Detached Retina Diagnosed?,Your ophthalmologist will put drops in your eye todilate (widen) the pupil. Then they will look through a special lens to check yourretinafor any changes.
How Is a Detached Retina Treated?,Surgery is done to repair adetached retina. Here are some types of detached retina surgery:
What Are the Risks of Surgery for Detached Retina?,"All surgery has risks of problems. But if you do not treat a detached retina, you could quickly and permanently lose your sight. Here are some of the risks of surgery for detached retina: Eye infection Bleeding in your eye Increased pressure inside the eye, which can lead toglaucoma Cataract, when thelensin your eye becomes cloudy Need for a second surgery. This happens in 1 out of 20 patients. Chance that the retina does not reattach properly Chance that the retina detaches again Chance of permanent reduced vision even after surgery to reattach the retina. Your ophthalmologist will discuss these.............................."
Should I be worried about my eye twitching?,"For the majority of us, the commoneyelid twitchis a brief and minor annoyance. An eyelid twitch (or tic) is when you have a spasm or slight movement of your upper or lower eyelid. It comes on suddenly, and can last for a minute, hours, days or even longer. If you've ever experienced an eye twitch for an extended period of time, you know how annoying it is."
Is eye twitching a symptom of a serious condition?,"Most common eyelid twitches are harmless, slight, and do not affect your vision. However, there are some neurological problems that can make eyelid muscles contract, such asblepharospasm and hemifacial spasm. These less common conditions generally tend to cause the eyelids to close more fully and for longer periods of time, limiting or completely blocking vision. Other muscles in the face may be affected as well."
What causes an eye twitch?,"When eye twitching lasts a long time or occurs more frequently than usual, these culprits are often to blame:"
What Are Dilating Eye Drops?,"Yourpupilsare the round, black openings at the center of youriris(the colored part of your eye). Your iris opens and closes the pupil to allow more or less light into the eye.For your eye doctor to look inside your eyes, your pupils must be dilated (widened). Dilating eye drops enlarge your pupils and keep them from getting smaller when the doctor shines light in your eyes.What to Expect When Your Eyes Are DilatedYour eye doctor will put a small amount of dilating eye drops into each of your eyes. It usually takes about 20 to 30 minutes for your pupils to........."
What Are Floaters and Flashes?,"What Are Floaters?Floaters look like small specks, dots, circles, lines or cobwebs in your field of vision. While they seem to be in front of your eye, they are floating inside. Floaters are tiny clumps of gel or cells inside thevitreousthat fills your eye. What you see are the shadows these clumps cast on yourretina.You usually notice floaters when looking at something plain, like a blank wall or a blue sky.As we age, our vitreous starts to thicken or shrink. Sometimes clumps or strands form in the vitreous. If the vitreous pulls away from the back of the eye, it..."
What Are Floaters?,"Floaters look like small specks, dots, circles, lines or cobwebs in your field of vision. While they seem to be in front of your eye, they are floating inside. Floaters are tiny clumps of gel or cells inside thevitreousthat fills your eye. What you see are the shadows these clumps cast on yourretina. You usually notice floaters when looking at something plain, like a blank wall or a blue sky. As we age, our vitreous starts to thicken or shrink. Sometimes clumps or strands form in the vitreous. If the vitreous pulls away from the back of the eye, it..............."
Video: What Is Glaucoma?,Glaucoma is a leading cause of blindness for people over 60 years old. But blindness from glaucoma can often be prevented with early treatment.
What Is the Main Cause of Glaucoma?,"Your eye constantly makesaqueous humor. As new aqueous flows into your eye, the same amount should drain out. The fluid drains out through an area called thedrainage angle. This process keepspressure in the eye (called intraocular pressure or IOP)stable. But if the drainage angle is not working properly, fluid builds up. Pressure inside the eye rises, damaging the optic nerve. The optic nerve is made of more than a million tiny nerve fibers. It is like an electric cable made up of many small wires. As these nerve fibers die, you will develop blind spots in your vision. You may..."
How Do You Get Glaucoma?,There are two major types of glaucoma.
Do glaucoma suspects have symptoms?,"Some people have no signs of damage but havehigher than normal eye pressure (called ocular hypertension). These patients are considered ""glaucoma suspects"" and have a higher risk of eventually developing glaucoma. Some people are considered glaucoma suspects even if their eye pressure is normal. For example, their ophthalmologist may notice something different about their optic nerve. Most glaucoma suspects have no symptoms. That is why you need to be carefully monitored by your ophthalmologist if you are a glaucoma suspect. An ophthalmologist can check for any changes over time and begin treatment if needed."
Who Is at Risk for Glaucoma?,"Some people have a higher than normal risk of getting glaucoma. This includes people who: are over age 40 have family members with glaucoma are of African, Hispanic, or Asian heritage have high eye pressure arefarsightedornearsighted have had aneye injury use long-term steroid medications havecorneasthat are thin in the center have thinning of the optic nerve havediabetes,migraines, highblood pressure, poor blood circulation or other health problems affecting the whole body Talk with an ophthalmologist about your risk for getting glaucoma. People with more than one of these risk factors have an even higher risk of glaucoma."
Can Glaucoma Be Stopped?,"Glaucoma damage is permanent—it cannot be reversed. But medicine and surgery help to stop further damage. To treat glaucoma, your ophthalmologist may use one or more of the following treatments."
Amblyopia: What Is Lazy Eye?,"Amblyopia is when vision in one or both eyes does not develop properly during childhood. It is sometimes called lazy eye. Amblyopia is a common problem in babies and young children.Achild’s vision develops in the first few years of life. It is important to diagnose andtreat amblyopiaas early as possible. Otherwise, a child with amblyopia will not develop normal, healthy vision.What Is the Cause of Lazy Eye?Amblyopia can develop from other eye and vision problems. Here are some conditions that may cause amblyopia in a child.StrabismusStrabismusis when the eyes point in two different directions. One eye may be focused straight........."
What Is the Cause of Lazy Eye?,Amblyopia can develop from other eye and vision problems. Here are some conditions that may cause amblyopia in a child.
When Should a Child's Vision Be Tested?,"All children should have their vision checked by their pediatrician, family physician, or ophthalmologist at or before entering pre-K or kindergarten.If there is a family history of misaligned eyes,childhood cataractsor serious eye disease, an ophthalmologist should check their eyes when they are an infant. Most doctors test vision as part of a child's medical exam. If they see any sign of eye problems, they may send a child to an ophthalmologist for further tests."
Nearsightedness: What Is Myopia?,"Nearsightedness (myopia) is when close-up objects look clear but distant objects are blurry. For instance, you can read a map clearly but have trouble seeing well enough to drive a car.Video: How the Eye WorksNearsightedness: Myopia TypesNearsightedness: Myopia SymptomsNearsightedness: Myopia CausesVideo: Nearsightedness (Myopia)Nearsightedness: Myopia DiagnosisNearsightedness: Myopia TreatmentNearsightedness: Myopia PreventionAdditional Information About MyopiaNearsightedness is a common eye focusing disorder. It has been on the rise for several decades. It is estimated that by 2050, nearly half the people in the world will have nearsightedness.Video: How the eye worksNearsightedness: Myopia TypesHigh myopia and low myopia.Mild nearsightedness (generally less than 3 diopters of...................................."
What Causes a Stye?,"A stye (also called a hordeolum) is a small, red, painful lump that grows from the base of youreyelashor under theeyelid. Most styes are caused by a bacterial infection. There are two kinds of styes: External hordeolum: A stye that begins at the base of your eyelash. Most are caused by an infection in the hair follicle. It might look like a pimple. Internal hordeolum: A stye inside your eyelid. Most are caused by an infection in an oil-producing gland in your eyelid. You can also get a stye if you haveblepharitis. This is a condition that makes your eyelids......"
What Is the Difference Between a Stye and a Chalazion?,"Sometimes it can be difficult to tell the difference between a stye and a chalazion. A stye is very painful. It often appears at the eyelid’s edge, usually caused by an infected eyelash root. It often swells, sometimes affecting the entire eyelid. A chalazion is not usually painful. It is a bump that usually develops farther back on the eyelid than a stye. It is caused by a clogged oil gland. Rarely does it make the entire eyelid swell."
Who Is At Risk for a Stye or a Chalazion?,"Anyone can get a stye or chalazion. But you are even more likely to get one if you have: Blepharitis, a problem that affects the edge of your eyelid Had a stye or chalazion before A skin condition, such as acne rosacea or seborrheic dermatitis Diabetesor other medical problems"
How Do You Get Rid of a Stye or a Chalazion?,Here are ways to treat your stye or chalazion:
Do ADHD Drugs Increase Glaucoma Risk?,"Researchers tackled this question by looking at healthcare claims from 240,257 people who started using an ADHD drug – either methylphenidate (such as Ritalin), amphetamines (such as Adderall), or atomoxetine (such as Strattera) – between 2010 and 2020. They found that people who used methylphenidate were slightly (1.2 times) more likely than others to develop the most common form of glaucoma, calledopen angle glaucoma.People who used amphetamines or atomoxetine were more than twice as likely than others to developangle closure glaucoma. But just because these two things happen together doesn’t mean one caused the other. It is not clear how........."
Looking for more sources of eye health information?,Browse NEI’s Eye Health Organizations Database See tips about finding an eye doctor near you Facebook Twitter LinkedIn YouTube
How will my eye doctor check for AMD?,"Eye doctors can check for AMD as part of a comprehensive dilated eye exam. The exam is simple and painless — your doctor will give you some eye drops to dilate (widen) your pupil and then check your eyes for AMD and other eye problems. Your doctor may also recommend doing a test called optical coherence tomography (OCT). In an OCT test, your eye doctor will take pictures of the inside of your eye with a special machine."
