Question,Answer
Optometrist vs. Ophthalmologist: What’s the Difference?,"Optometrist Ophthalmologist Optician Bottom line An optometrist treats your eyes. In contrast, an ophthalmologist focuses on doing surgical procedures for eye conditions, while an optician helps you fit eyeglasses and other vision-correcting devices. If you’ve ever had to search for an eye care doctor, you’re likely aware that there are several different types of eye specialists. Optometrists, ophthalmologists, and opticians are all professionals who specialize in eye care. In this article, we will explore the education requirements, salary, scope of practice, and services that optometrists, ophthalmologists, and opticians provide. We will also discuss how to choose the best eye-care professional for your needs."
What is an optometrist and what do they do?,"An optometrist is the primary health care provider for routine eye care. An optometry program is a postgraduate program that takes roughly 4 years to complete, depending on the school and curriculum. The program curriculum includes: basic and advanced eye examination techniques client case history and case studies additional courses in the natural sciences (including optics) and pharmacology Optometry program coursework also includes full-time clinical training as a resident during the final 1 to 2 years of the program. In2018, the median salary for optometrists was $111,790, according to the Bureau of Labor Statistics. You can visit an optometrist for your yearly eye exam, to refill an eyeglass or contact prescription, or even to receive medication and treatment for certain eye conditions. Unlike an ophthalmologist, an optometrist is not a surgical specialist and cannot treat more serious eye conditions. Optometrists provide the following services:: annual orroutine eye exams, including eye health education diagnosis of eye conditions prescriptions for eyeglasses, contact lenses, and other visual aids medical treatments or minor surgical procedures for eye conditions post-surgical eye care Optometrists can prescribe controlled medications for eye conditions. Depending on the state legislation, some optometrists can also perform minor surgeries. These surgical procedures."
What Are the Job Duties of an Optometrist?,"When someone starts having vision trouble, they see an optometrist for basic vision care. Optometrists do routine vision checks and tests, examine other parts of the visual system and diagnose and treat minor eye problems, diseases and injuries. If necessary, the optometrist prescribes glasses or contact lenses, finding the right vision correction level and fit for each person. They also do minor surgical procedures, offer pre- and post-op care for more involved surgeries with an ophthalmologist and promote general eye health and care."
How Do the Job Duties of an Ophthalmologist Differ From an Optometrist?,"Ophthalmologists can do all the above duties that optometrists can, as well as perform eye surgery. They have the additional skills to specialize in surgery for conditions like glaucoma and cataracts. They also perform corneal, vitro-retinal, eye muscle and oculoplastic surgeries. Before surgery even takes place, the ophthalmologist puts the patient through a complete exam to diagnose the issue and create the best treatment plan. An ophthalmologist can also treat more complicated eye injuries, including those dealing with other eye structures like the cornea, sclera, conjunctiva and eyelids."
Where Do Optometrists and Ophthalmologists Work?,"Many optometrists own their practices, sometimes working in a practice with other optometrists. Some optometrists only work with a certain population, specializing in one type of eye care such as pediatrics or low vision. Optometrists also find employment in postsecondary education, as consultants and in research roles. Ophthalmologists work in mostly in hospitals and surgery centers, but some also have their own practices. Both generally work full-time, putting in hours in the evenings and on the weekends to fit patient schedules."
What Is the Average Optometrist Salary?,"According to the U.S. Bureau of Labor Statistics, the median annual wage for optometrists was$110,300, as of May 2017. This means that half of the industry made more and half made less. Those in the top 10 percent of earners made$190,090, while the bottom 10 percent brought home less than$53,740. Optometrists employed in private doctor practices made the most at$124,060, while those in government roles made the least at$94,280. These states have the highest averageeye doctor salary: Connecticut ($192,870). Alaska ($187,800). Maryland ($141,870). Oklahoma ($136,740). Massachusetts ($135,780)."
What Is the Average Ophthalmologist Salary?,"Ophthalmologists earn an average of$357,000a year, according to the Medscape Ophthalmologist Compensation Report from 2018. The salary for self-employed ophthalmologists is$429,000, higher than the salary for those working for other entities, which is an average of$256,000. More years of experience generally equals higher pay. Those with 0 to 5 years of experience earn an average of$180,000, while 20-plus years of experience gets you about$270,000a year."
What Are the Symptoms of Glaucoma?,"The most common type of glaucoma is primary open-angle glaucoma. It has no signs or symptoms except gradual vision loss. For that reason, it’s important that you go to yearly comprehensive eye exams so your ophthalmologist, or eye specialist, can monitor any changes in your vision. Acute-angle closure glaucoma, which is also known as narrow-angle glaucoma, is a medical emergency. See your doctor immediately if you experience any of the following symptoms: severe eye pain nausea vomiting redness in your eye sudden vision disturbances seeing colored rings around lights sudden blurred vision"
What Causes Glaucoma?,"The back of your eye continuously makes a clear fluid called aqueous humor. As this fluid is made, it fills the front part of your eye. Then, it leaves your eye through channels in your cornea and iris. If these channels are blocked or partially obstructed, the natural pressure in your eye, which is called the intraocular pressure (IOP), may increase. As your IOP increases, your optic nerve may become damaged. As damage to your nerve progresses, you may begin losing sight in your eye. What causes the pressure in your eye to increase isn’t always known. However, doctors believe one or more of these factors may play a role: dilating eye drops blocked or restricted drainage in your eye medications, such as corticosteroids poor or reduced blood flow to your optic nerve high or elevated blood pressure"
What Are the Types of Glaucoma?,"Five major types of glaucoma exist. These are: Open-angle, or chronic, glaucoma has no signs or symptoms except gradual vision loss. This loss may be so slow that your vision can suffer irreparable damage before any other signs become apparent. According theNational Eye Institute (NEI), this is the most common type of glaucoma. If the flow of your aqueous humor fluid is suddenly blocked, the rapid buildup of fluid may cause a severe, quick, and painful increase in pressure. Angle-closure glaucoma is an emergency situation. You should call your doctor immediately if you begin experiencing symptoms, such as severe pain, nausea, and blurred vision. Children born with congenital glaucoma have a defect in the angle of their eye, which slows or prevents normal fluid drainage. Congenital glaucoma usually presents with symptoms, such as cloudy eyes, excessive tearing, or sensitivity to light. Congenital glaucoma can run in families. Secondary glaucoma is often a side effect of injury or another eye condition, such as cataracts or eye tumors. Medicines, such as corticosteroids, may also cause this type of glaucoma. Rarely, eye surgery can cause secondary glaucoma. In some cases, people without increased eye pressure develop damage to their optic nerve. The cause."
What causes crossed eyes?,"Crossed eyes occur either due to nerve damage or when the muscles around your eyes don’t work together because some are weaker than others. When your brain receives a different visual message from each eye, it ignores the signals coming from your weaker eye. If your condition isn’t corrected, you may lose vision in your weaker eye. Crossed eyes are common in children. Often the underlying cause is unknown. Infantile esotropia is a type of crossed eyes that appears in babies during their first year of life. Esotropia runs in families and usually requires surgery to correct. Acquired esotropia occurs in children usuallybetween the ages of 2 and 5. Eyeglasses can usually correct it. Crossed eyes can also occur later in life. It’s usually caused by physical disorders, like eye injuries, cerebral palsy, or stroke. You may also develop crossed eyes if you have alazy eyeor arefarsighted."
How is crossed eyes diagnosed?,"To prevent vision loss, early diagnosis and treatment for crossed eyes is important. If you develop symptoms of crossed eyes, make an appointment with an eye doctor. They’ll perform a series of tests to check the health of your eyes that may include: a corneal light reflex test to check for crossed eyes avisual acuity testto determine how well you can read from a distance a cover/uncover test to measure your eye movement and deviation a retina exam to examine the backs of your eyes If you have other physical symptoms along with crossed eyes, your doctor may examine your brain and nervous system for other conditions. For example, they may conduct tests to check for cerebral palsy orGuillain-Barré syndrome. It’s common for newborn babies to have crossed eyes. If your baby has crossed eyes that persist beyond 3 months of age, make an appointment with their doctor. Young children should undergo an eye exam before 3 years of age."
Who is at risk of crossed eyes?,"You’re more likely to develop crossed eyes if you: have family members who have crossed eyes have a brain disorder or brain tumor have had a stroke or brain injury have a lazy eye, are farsighted, or have vision loss have a damaged retina havediabetes"
How are crossed eyes treated?,"Your recommended treatment plan for crossed eyes will depend on the severity and underlying cause of your condition. If your crossed eyes have resulted from a lazy eye, your doctor may have you wear a patch over your stronger eye to force the muscles of your weaker eye to work harder. Your doctor might also prescribe eye drops to blur the vision in your stronger eye. They can also useBotox injectionsto weaken the muscle that’s overacting and causing the eye turn. Other potential treatments include: eye exercises corrective lenses, such as eyeglasses or contact lenses surgery on certain eye muscles, particularly if corrective lenses haven’t corrected the condition If your crossed eyes are caused by an underlying medical condition, such as abrain tumoror stroke, your doctor may prescribe medication, surgery, or other treatments."
What is the long-term outlook for crossed eyes?,"Often crossed eyes can be corrected with corrective lenses, eye patches, surgery in rare cases, or by other modalities. It’s important to seek treatment right away to lower your risk for vision loss. After you’ve received treatment, watch your eyes for changes. In some cases, the condition may come back. If your crossed eyes are caused by an underlying medical condition, early diagnosis and treatment may help improve your chances of recovery. Ask your doctor for more information about your specific condition and treatment options. Last medically reviewed on August 20, 2019 Esotropia. (n.d.).https://utswmed.org/conditions-treatments/esotropia-crossed-eyes/ Mayo Clinic Staff. (2019). Lazy eye (amblyopia).http://www.mayoclinic.org/diseases-conditions/lazy-eye/home/ovc-20201878 Olitsky SE, et al. (2016). Strabismus: Accommodativeesotropia.https://www.aao.org/disease-review/strabismus-accommodative-esotropia Strabismus (crossed eyes). (n.d.).http://www.aoa.org/patients-and-public/eye-and-vision-problems/glossary-of-eye-and-vision-conditions/strabismus?sso=y Share this article 3 Eye Exercises to Help StrabismusMedically reviewed byJudith Marcin, M.D.Simple eye exercises can help in the treatment of a condition called strabismus, also known as crossed eyes. Learn how to perform these exercises at…READ MORE Simple eye exercises can help in the treatment of a condition called strabismus, also known as crossed eyes. Learn how to perform these exercises at… What Is Hypertropia?Medically reviewed byAnn Marie Griff, O.D.Hypertropia is an eye condition that has different causes in children and adults. We'll explain these causes and."
What is a doctor of optometry/optometrist?,"Doctors of optometry (O.D.s/optometrists), America’s primary eye health care providers, are the frontline of eye and vision care. Doctors of optometry are essential health care providers and are recognized as physicians under Medicare. They examine, diagnose, treat and manage diseases and disorders of the eye. In addition to providing eye and vision care, they play a major role in an individual’s overall health and well-being by detecting systemic diseases, and diagnosing, treating and managing ocular manifestations of those diseases, and providing vaccinations. Doctors of optometry: Prescribe medications, low vision rehabilitation, vision therapy, spectacle lenses, contact lenses and perform certain surgical procedures. Counsel patients regarding surgical and non-surgical options that meet their visual needs related to their occupations, avocations and lifestyle. Complete pre-professional undergraduate education in a college or university and four years of professional education at a college of optometry, leading to the doctor of optometry (O.D.) degree. Many doctors of optometry complete an additional residency in a specific area of practice. More than 30,000 doctors of optometry nationwide are available to provide high-quality eye health and vision care services. Make your health a priority by scheduling an appointment with alocal AOA doctortoday!"
What is a comprehensive eye exam?,"Acomprehensive eye examconducted by a doctor of optometry determines the eye and vision health of a patient. During the exam, the doctor checks not only visual acuity through refraction but also the health of your eyes, eye tissue and other diseases. Each patient's symptoms, along with the doctor of optometry’s professional judgment, will determine what tests are conducted."
Why is it important to get comprehensive eye exams with a doctor of optometry?,"An in-person, comprehensive eye exam with a doctor of optometry is the medically recognized standard to assure precise and healthy vision, identify and treat diseases, such as glaucoma, a leading cause of blindness. In addition, eye exams safeguard overall health by enabling the doctor todetect more than 270 serious health conditionsincluding diabetes, high blood pressure, autoimmune diseases and cancers. In fact, in 2018 alone, doctors of optometry identified signs of diabetes in more than 301,000 patients who did not know they had the condition. In-person, comprehensive eye exams are one of the most important, preventive ways to preserve vision and overall health."
What is the difference between a comprehensive eye exam and a vision screening?,"Current vision screening methods cannot be relied on to effectively identify individuals who need vision care. These types of screenings are offered at schools, pediatrician offices or at the DMV. While they may uncover some vision problems, they can miss more than they find. In some cases, vision screenings can give a false sense of security for those individuals who ""pass"" the screening and inhibit the early diagnosis of vision problems. These people are then less likely to receive treatment for their vision problem and it could become worse. A comprehensive eye exam includes a range of tests in order to do a complete evaluation of the health of your eyes and your vision. Not only can your doctor of optometry assess your eye health, they can identify symptoms of conditions elsewhere in the body like brain tumors, aneurysms, high blood pressure and diabetes. Learn more about thelimitations of vision screenings. Share your story Find a Doctor Vision and Vision Correction Caring for Your Eyes Eye Health for Life Eye and Vision Conditions Eye Deserve More Forgotusernameorpassword? You do not have access to this content. Call 314.983.4167 for assistance. Not a member?Join the AOA today! About the AOA Leadership Ethics."
Eye Numbing Drops: Why Are They Used and Are They Safe?,"Types Uses Side effects Application and precautions Over-the-counter Summary Medical professionals use eye numbing drops to block the nerves in your eye from feeling pain or discomfort. If you’re pregnant or nursing, tell your doctor before getting eye numbing drops. Eye numbing drops are considered atopical anesthetic. They’re used duringeye examsand for surgical procedures involving your eyes. It’s important to understand the distinction between eye numbing drops (used for surgical procedures and eye exams) and other types ofeye drops. Saline drops, artificial tears, and anti-allergy or anti-histamine drops are available over-the-counter to soothe and hydrate your eyes. Antibiotic eye drops are available by prescription to treat eye injuries, likecorneal abrasions. Numbing eye drops don’t have soothing, hydrating, anti-allergy, or antibiotic properties. They’re an anesthetic medication for your eye. When administered in small doses, these drops are considered safe. However, there are some risks of side effects if they’re overused. There are two main types of eye drops used in eye exams and surgical procedures. Both are available only by prescription. Tetracaine drops (AltaCaine, Tetcaine) block the nerve endings in your eye from signaling pain to your brain. Tetracainehas been foundto cause cell death in the cells of your cornea if."
How does astigmatism affect my vision?,"Astigmatismis a common vision condition that causes blurriness or distorted vision. It can affect the way light refracts on the retina. On a prescription, this will be written as part of the cylindrical (CYL) correction. If you see no number under CYL, it means you have no astigmatism, or the astigmatism is so slight you don’t need to correct it."
What is 20/20 vision?,"20/20 vision means you have normal visual acuity (or sharpness and clarity) at a distance of 20 feet away. It doesn’t mean perfect vision, though. It only means you can see clearly at a distance. Overall visual ability also measures: peripheral or side vision eye coordination depth of perception focusing ability color vision 20/15 vision is actually better than 20/20. Someone with 20/15 vision can see objects at 20 feet away that someone with 20/20 can only see at 15 feet away. The higher the second number, the less clear and sharp you’ll see objects at a distance. Someone with 20/200 has some vision, but doesn’t see with the same clarity as people with a 20/100 or 20/40 vision. Depending on your visual acuity, your ophthalmologist or optometrist will be able to determine if eyeglasses or contacts can help. In some cases, you may not be able to get 20/20 vision with corrective lenses, but you may be able to see more clearly than you would without glasses or contacts."
Will your vision get worse?,"Vision doesn’t worsen as a result of getting older, but your risk for eye-related conditions and diseases does get increase as you age. For example, you’re at a higher risk for the following after age 50: age-relatedmacular degeneration cataracts glaucoma diabetic retinopathy For better eye health, you can try the following in addition to eating ahealthy dietand exercising regularly: wear sunglasses and a brimmed hat when you’re out in bright sunshine wear protective eyewear when playing sports, or using power tools or chemicals maintain ahealthy blood pressure"
How often should you get your eyes checked?,"Your prescription can change, so it’s important to get regular eye exams. Adults ages 19 to 40 with vision problems should get their eyes checked at least every two years. Adults older than 40 should get them checked once a year. If you’re an adult with no vision problems, get your eyes checked every five years until age 30, and then at least every 2 to 4 years from age 40 to 65. After age 65, you’ll need regular eye exams at least every two years. Let your doctor know if you notice any changes to your vision and need to be seen more often. At checkups, your doctor will also screen for eye conditions like glaucoma, which can be treated if caught early. Your vision prescription can change over time. It’s important to get regular eye checkups so your glasses and contact prescription stays up to date. Your eye doctor can also check for common eye conditions that may require additional treatment or correction. If your vision changes or you’re having trouble seeing clearly, make an appointment to get your eyes checked and let your doctor know your symptoms. Last medically reviewed on December 14, 2018 Are you eye."
How Long Does It Take for the Effects from Eye Dilation Drops to Wear Off?,"Side effects Purpose Tips Eye health Takeaway Getting your eyes dilated is an important part of any complete eye exam. Once your doctor puts in the dilating drops, it takes about 20–30 minutes for your pupils to fully open, or dilate. After your eyes are fully dilated, the effects will last for four to six hours for most people. Some people feel the effects of dilating drops for longer, including people with lighter color eyes. Dilation in children can last up to a full day after the exam. It’s impossible for your doctor to tell you exactly how long the effects of dilation will last and how severe they will be. Everyone’s eyes react differently to dilating drops. The important thing is to use caution as long as your vision is blurry or your eyes are light-sensitive."
What are the side effects of eye dilation drops?,"Dilation is harmless in the long term, but it does come with short-term side effects. These will usually last for about four to six hours. Side effects of dilation include: light sensitivity blurry vision trouble focusing on close objects stinging right after the drops are put in If you wear contact lenses, you may not be able to wear them until the dilation drops wear off."
Why is eye dilation important?,"Dilation allows an eye doctor to look inside your eyes. Dilating drops widen the pupil (the black part of your eye) so that it doesn’t get smaller when your doctor shines a light at it. The widened pupil allows your doctor to use a magnifying lens to look inside your eye and at the back of your eye. They’ll look at the retina, optic nerve, blood vessels, and other parts of your eye that can’t otherwise be seen. Dilation helps your eye doctor diagnose many eye conditions, including glaucoma retinal detachment age-relatedmacular degeneration diabetic retinopathy It also helps diagnose some chronic conditions that affect more than your eye, such ashigh blood pressureanddiabetes. This is because those conditions can lead to changes in the eye. For example, high blood pressure could damage the blood vessels in your retina, which can be seen only when your eye is dilated. Dilating drops can also be used to treat certain eye conditions. These include eye inflammation andamblyopia, also called a lazy eye, which is a condition where one eye doesn’t properly connect with the brain. Dilating drops used as treatment have the same effects as drops used during exams. Dilation can cause blurry vision."
What’s the Difference Between PRK and LASIK?,"How they work Recovery Efficacy Risks Candidate Cost Pros and cons Finding a provider Takeaway PRK vs. LASIK Photorefractive keratectomy (PRK) and laser-assisted in situ keratomileusis (LASIK) are both laser surgery techniques used to help improve eyesight. PRK has been around longer, but both are still widely used today. PRK and LASIK are both used to modify thecorneaof your eye. The cornea is made up of five thin, transparent layers of tissue over the front of your eye that bend (or refract) and focus light to help you see. PRK and LASIK each use different methods to help correct your vision by reshaping cornea tissue. With PRK, your eye surgeon takes away the top layer of the cornea, known as the epithelium. Your surgeon then uses lasers to reshape the other layers of the cornea and fix any irregular curvature in your eye. With LASIK, your eye surgeon uses lasers or a tiny blade to create a small flap in your cornea. This flap is raised up, and your surgeon then uses lasers to reshape the cornea. The flap is lowered back down after the surgery is complete, and the cornea repairs itself over the next few months. Either technique."
